[
  {
    "id": "PNCP_51174001000193-1-000022_2024",
    "numero": "2024/000020121",
    "tipo": "Serviços",
    "fornecedor": "A definir",
    "objeto": "Contratação de empresa especializada para serviço de aplicação estimada de 35.000 (trinta e cinco mil) doses de vacinas trivalentes contra a gripe, para a campanha de vacinação de 2024 de Magistrados, Servidores e funcionários terceirizados que prestam serviços nas comarcas da Capital, da Grande São Paulo e do Interior",
    "vigencia": "25/04/2024 a 25/04/2025",
    "valor": 787500.0,
    "status": "ativo",
    "data_inicio": "2024-04-25T07:12:00",
    "data_fim": "2025-04-25T00:00:00",
    "fiscal_titular": "A definir",
    "fiscal_substituto": "A definir",
    "ultima_atualizacao": "2025-12-17T19:40:20.946392",
    "fonte": "PNCP",
    "controle_pncp": "51174001000193-1-000022/2024",
    "modalidade": "Pregão - Eletrônico",
    "amparo_legal": "Lei 14.133/2021, Art. 28, I",
    "link_pncp": "https://cnetmobile.estaleiro.serpro.gov.br/comprasnet-web/public/landing?destino=acompanhamento-compra&compra=92649505900212024",
    "comarca_detectada": "da Capital",
    "aditivos": [],
    "total_aditivos": 0
  },
  {
    "id": "PNCP_51174001000193-1-000026_2024",
    "numero": "2024/00008796",
    "tipo": "Fornecimento",
    "fornecedor": "A definir",
    "objeto": "Fornecimento de água mineral sem gás, em garrafões de 20 litros, para prédios da 6ª RAJ - Lote 6 (41ª CJ - Ribeirão Preto, Cajuru, Cravinhos, Jardinópolis, Pontal, Santa Rosa de Viterbo, São Simão, Serrana e Sertãozinho)",
    "vigencia": "30/04/2024 a 30/04/2025",
    "valor": 111720.0,
    "status": "ativo",
    "data_inicio": "2024-04-30T08:14:00",
    "data_fim": "2025-04-30T00:00:00",
    "fiscal_titular": "A definir",
    "fiscal_substituto": "A definir",
    "ultima_atualizacao": "2025-12-17T19:40:20.946540",
    "fonte": "PNCP",
    "controle_pncp": "51174001000193-1-000026/2024",
    "modalidade": "Pregão - Eletrônico",
    "amparo_legal": "Lei 14.133/2021, Art. 28, I",
    "link_pncp": "https://cnetmobile.estaleiro.serpro.gov.br/comprasnet-web/public/landing?destino=acompanhamento-compra&compra=92649505900032024",
    "comarca_detectada": "Não especificada",
    "aditivos": [],
    "total_aditivos": 0
  },
  {
    "id": "PNCP_51174001000193-1-000024_2024",
    "numero": "2024/00014853",
    "tipo": "Fornecimento",
    "fornecedor": "A definir",
    "objeto": "Fornecimento de água mineral sem gás, em garrafões de 20 litros, para prédios da 9ª RAJ (46ª CJ - Jacareí, Paraibuna e São José dos Campos)",
    "vigencia": "29/04/2024 a 29/04/2025",
    "valor": 187110.0,
    "status": "ativo",
    "data_inicio": "2024-04-29T08:09:00",
    "data_fim": "2025-04-29T00:00:00",
    "fiscal_titular": "A definir",
    "fiscal_substituto": "A definir",
    "ultima_atualizacao": "2025-12-17T19:40:20.946709",
    "fonte": "PNCP",
    "controle_pncp": "51174001000193-1-000024/2024",
    "modalidade": "Pregão - Eletrônico",
    "amparo_legal": "Lei 14.133/2021, Art. 28, I",
    "link_pncp": "https://cnetmobile.estaleiro.serpro.gov.br/comprasnet-web/public/landing?destino=acompanhamento-compra&compra=92649505900012024",
    "comarca_detectada": "Não especificada",
    "aditivos": [],
    "total_aditivos": 0
  },
  {
    "id": "PNCP_51174001000193-1-000025_2024",
    "numero": "2024/00024620",
    "tipo": "Fornecimento",
    "fornecedor": "A definir",
    "objeto": "Fornecimento de água mineral sem gás, em garrafões de 20 litros, para prédios da 8ª RAJ (17ª CJ - Votuporanga, Cardoso e Nhandeara)",
    "vigencia": "29/04/2024 a 29/04/2025",
    "valor": 122880.0,
    "status": "ativo",
    "data_inicio": "2024-04-29T08:31:00",
    "data_fim": "2025-04-29T00:00:00",
    "fiscal_titular": "A definir",
    "fiscal_substituto": "A definir",
    "ultima_atualizacao": "2025-12-17T19:40:20.946900",
    "fonte": "PNCP",
    "controle_pncp": "51174001000193-1-000025/2024",
    "modalidade": "Pregão - Eletrônico",
    "amparo_legal": "Lei 14.133/2021, Art. 28, I",
    "link_pncp": "https://cnetmobile.estaleiro.serpro.gov.br/comprasnet-web/public/landing?destino=acompanhamento-compra&compra=92649505900022024",
    "comarca_detectada": "Não especificada",
    "aditivos": [],
    "total_aditivos": 0
  },
  {
    "id": "PNCP_51174001000193-1-000030_2024",
    "numero": "2024/00017081",
    "tipo": "Fornecimento",
    "fornecedor": "A definir",
    "objeto": "Contratação de empresa especializada para o fornecimento de água mineral natural, potável, sem gás, acondicionada em garrafão plástico retornável, em regime de comodato, com capacidade para 20 litros e com lacre de segurança, com entrega parcelada e sucessiva, a serem distribuídos nas unidades da 23ª CJ do Tribunal de Justiça do Estado de São Paulo da 3ª RAJ do Tribunal de Justiça do Estado de São Paulo (Botucatu, Conchas, Itatinga e São Manuel), em Lote Único.",
    "vigencia": "03/05/2024 a 03/05/2025",
    "valor": 52920.0,
    "status": "ativo",
    "data_inicio": "2024-05-03T07:10:00",
    "data_fim": "2025-05-03T00:00:00",
    "fiscal_titular": "A definir",
    "fiscal_substituto": "A definir",
    "ultima_atualizacao": "2025-12-17T19:40:20.947074",
    "fonte": "PNCP",
    "controle_pncp": "51174001000193-1-000030/2024",
    "modalidade": "Pregão - Eletrônico",
    "amparo_legal": "Lei 14.133/2021, Art. 28, I",
    "link_pncp": "https://cnetmobile.estaleiro.serpro.gov.br/comprasnet-web/public/landing?destino=acompanhamento-compra&compra=92649505900062024",
    "comarca_detectada": "Não especificada",
    "aditivos": [],
    "total_aditivos": 0
  },
  {
    "id": "PNCP_51174001000193-1-000028_2024",
    "numero": "2024/00012110",
    "tipo": "Fornecimento",
    "fornecedor": "A definir",
    "objeto": "Fornecimento de água mineral natural, potável, sem gás, acondicionada em garrafão plástico retornável, em regime de comodato, com capacidade para 20 litros para a 51ª Circunscrição Judiciária (Caraguatatuba, São Sebastião e Ubatuba), em Lote Único",
    "vigencia": "02/05/2024 a 02/05/2025",
    "valor": 95625.0,
    "status": "ativo",
    "data_inicio": "2024-05-02T07:11:00",
    "data_fim": "2025-05-02T00:00:00",
    "fiscal_titular": "A definir",
    "fiscal_substituto": "A definir",
    "ultima_atualizacao": "2025-12-17T19:40:20.947250",
    "fonte": "PNCP",
    "controle_pncp": "51174001000193-1-000028/2024",
    "modalidade": "Pregão - Eletrônico",
    "amparo_legal": "Lei 14.133/2021, Art. 28, I",
    "link_pncp": "https://cnetmobile.estaleiro.serpro.gov.br/comprasnet-web/public/landing?destino=acompanhamento-compra&compra=92649505900042024",
    "comarca_detectada": "Não especificada",
    "aditivos": [],
    "total_aditivos": 0
  },
  {
    "id": "PNCP_51174001000193-1-000031_2024",
    "numero": "2024/00030139",
    "tipo": "Fornecimento",
    "fornecedor": "A definir",
    "objeto": "Contratação de empresa especializada para o fornecimento de água mineral natural, potável, sem gás, acondicionada em garrafão plástico retornável, em regime de comodato, com capacidade para 20 litros e com lacre de segurança, com entrega parcelada e sucessiva, a serem distribuídos nas unidades da 12ª CJudiciária do Tribunal de Justiça do Estado de São Paulo da 6ª RAJ do Tribunal de Justiça do Estado de São Paulo (São Carlos, Descalvado, Ibaté e Ribeirão Bonito) em Lote Único",
    "vigencia": "03/05/2024 a 03/05/2025",
    "valor": 161814.0,
    "status": "ativo",
    "data_inicio": "2024-05-03T07:11:00",
    "data_fim": "2025-05-03T00:00:00",
    "fiscal_titular": "A definir",
    "fiscal_substituto": "A definir",
    "ultima_atualizacao": "2025-12-17T19:40:20.947440",
    "fonte": "PNCP",
    "controle_pncp": "51174001000193-1-000031/2024",
    "modalidade": "Pregão - Eletrônico",
    "amparo_legal": "Lei 14.133/2021, Art. 28, I",
    "link_pncp": "https://cnetmobile.estaleiro.serpro.gov.br/comprasnet-web/public/landing?destino=acompanhamento-compra&compra=92649505900072024",
    "comarca_detectada": "Não especificada",
    "aditivos": [],
    "total_aditivos": 0
  },
  {
    "id": "PNCP_51174001000193-1-000029_2024",
    "numero": "2024/00031836",
    "tipo": "Fornecimento",
    "fornecedor": "A definir",
    "objeto": "Contratação de fornecimento de água mineral natural, potável, sem gás, acondicionada em garrafão plástico retornável, em regime de comodato, com capacidade para 20 litros e lacre de segurança, com entrega parcelada e sucessiva, a serem distribuídos nas unidades da 6ª Região Administrativa Judiciária - 6ª RAJ - (38ª CJ – Franca e Patrocínio Paulista, e 39ª CJ – Batatais, Altinópolis, Brodowski, Morro Agudo, Nuporanga e Orlândia), em Lote Único",
    "vigencia": "02/05/2024 a 02/05/2025",
    "valor": 75240.0,
    "status": "ativo",
    "data_inicio": "2024-05-02T07:12:00",
    "data_fim": "2025-05-02T00:00:00",
    "fiscal_titular": "A definir",
    "fiscal_substituto": "A definir",
    "ultima_atualizacao": "2025-12-17T19:40:20.947617",
    "fonte": "PNCP",
    "controle_pncp": "51174001000193-1-000029/2024",
    "modalidade": "Pregão - Eletrônico",
    "amparo_legal": "Lei 14.133/2021, Art. 28, I",
    "link_pncp": "https://cnetmobile.estaleiro.serpro.gov.br/comprasnet-web/public/landing?destino=acompanhamento-compra&compra=92649505900052024",
    "comarca_detectada": "Não especificada",
    "aditivos": [],
    "total_aditivos": 0
  },
  {
    "id": "PNCP_51174001000193-1-000032_2024",
    "numero": "2024/00001274",
    "tipo": "Serviços",
    "fornecedor": "A definir",
    "objeto": "Contratação de empresa especializada para prestação de serviço de assinatura de software de design gráfico AutoCAD LT Single User 3 Year Subscription – Part Number: 057I1-007738-L882 – para 12 (doze) usuários",
    "vigencia": "07/05/2024 a 07/05/2025",
    "valor": 61800.0,
    "status": "ativo",
    "data_inicio": "2024-05-07T07:09:00",
    "data_fim": "2025-05-07T00:00:00",
    "fiscal_titular": "A definir",
    "fiscal_substituto": "A definir",
    "ultima_atualizacao": "2025-12-17T19:40:20.947757",
    "fonte": "PNCP",
    "controle_pncp": "51174001000193-1-000032/2024",
    "modalidade": "Pregão - Eletrônico",
    "amparo_legal": "Lei 14.133/2021, Art. 28, I",
    "link_pncp": "https://cnetmobile.estaleiro.serpro.gov.br/comprasnet-web/public/landing?destino=acompanhamento-compra&compra=92649505900082024",
    "comarca_detectada": "Não especificada",
    "aditivos": [],
    "total_aditivos": 0
  },
  {
    "id": "PNCP_51174001000193-1-000035_2024",
    "numero": "2024/00036742",
    "tipo": "Fornecimento",
    "fornecedor": "A definir",
    "objeto": "Aquisição de togas por meio de sistema de registro de preços",
    "vigencia": "10/05/2024 a 10/05/2025",
    "valor": 109000.0,
    "status": "ativo",
    "data_inicio": "2024-05-10T07:16:00",
    "data_fim": "2025-05-10T00:00:00",
    "fiscal_titular": "A definir",
    "fiscal_substituto": "A definir",
    "ultima_atualizacao": "2025-12-17T19:40:20.947883",
    "fonte": "PNCP",
    "controle_pncp": "51174001000193-1-000035/2024",
    "modalidade": "Pregão - Eletrônico",
    "amparo_legal": "Lei 14.133/2021, Art. 28, I",
    "link_pncp": "https://cnetmobile.estaleiro.serpro.gov.br/comprasnet-web/public/landing?destino=acompanhamento-compra&compra=92649505900092024",
    "comarca_detectada": "Não especificada",
    "aditivos": [],
    "total_aditivos": 0
  },
  {
    "id": "PNCP_51174001000193-1-000037_2024",
    "numero": "2023/00139288",
    "tipo": "Fornecimento",
    "fornecedor": "A definir",
    "objeto": "Registro de Preços de aquisição de cartões de proximidade para uso nos controles de acesso do SIM - Sistema Integrado de Monitoramento e furadores específicos",
    "vigencia": "15/05/2024 a 15/05/2025",
    "valor": 30750.0,
    "status": "ativo",
    "data_inicio": "2024-05-15T07:13:00",
    "data_fim": "2025-05-15T00:00:00",
    "fiscal_titular": "A definir",
    "fiscal_substituto": "A definir",
    "ultima_atualizacao": "2025-12-17T19:40:20.947981",
    "fonte": "PNCP",
    "controle_pncp": "51174001000193-1-000037/2024",
    "modalidade": "Pregão - Eletrônico",
    "amparo_legal": "Lei 14.133/2021, Art. 28, I",
    "link_pncp": "https://cnetmobile.estaleiro.serpro.gov.br/comprasnet-web/public/landing?destino=acompanhamento-compra&compra=92649505900102024",
    "comarca_detectada": "Não especificada",
    "aditivos": [],
    "total_aditivos": 0
  },
  {
    "id": "PNCP_51174001000193-1-000039_2024",
    "numero": "2024/00039130",
    "tipo": "Serviços",
    "fornecedor": "A definir",
    "objeto": "Contratação de empresa especializada para prestação de Serviços de Vigilância e Segurança Patrimonial armada com a finalidade de exercer preventivamente a proteção do patrimônio e das pessoas que se encontram nos limites das localidades a serem vigiadas, com a efetiva cobertura de postos nas comarcas da 49ª Circunscrição Judiciária – 10ª Região Administrativa Judiciária (Comarca de Itapeva e outros), que constituem um Lote Único",
    "vigencia": "20/05/2024 a 20/05/2025",
    "valor": 6619889.4,
    "status": "ativo",
    "data_inicio": "2024-05-20T07:25:00",
    "data_fim": "2025-05-20T00:00:00",
    "fiscal_titular": "A definir",
    "fiscal_substituto": "A definir",
    "ultima_atualizacao": "2025-12-17T19:40:20.948085",
    "fonte": "PNCP",
    "controle_pncp": "51174001000193-1-000039/2024",
    "modalidade": "Pregão - Eletrônico",
    "amparo_legal": "Lei 14.133/2021, Art. 28, I",
    "link_pncp": "https://cnetmobile.estaleiro.serpro.gov.br/comprasnet-web/public/landing?destino=acompanhamento-compra&compra=92649505900112024",
    "comarca_detectada": "da",
    "aditivos": [],
    "total_aditivos": 0
  },
  {
    "id": "PNCP_51174001000193-1-000043_2024",
    "numero": "2024/00042083",
    "tipo": "Serviços",
    "fornecedor": "A definir",
    "objeto": "Contratação de Serviços de Vigilância e Segurança Patrimonial armada nas comarcas da 28ª e 29ª Circunscrições Judiciárias – 5ª Região Administrativa Judiciária (Comarca de Presidente Epitácio e outros), que constituem um Lote Único",
    "vigencia": "21/05/2024 a 21/05/2025",
    "valor": 14489642.7,
    "status": "ativo",
    "data_inicio": "2024-05-21T07:07:00",
    "data_fim": "2025-05-21T00:00:00",
    "fiscal_titular": "A definir",
    "fiscal_substituto": "A definir",
    "ultima_atualizacao": "2025-12-17T19:40:20.948183",
    "fonte": "PNCP",
    "controle_pncp": "51174001000193-1-000043/2024",
    "modalidade": "Pregão - Eletrônico",
    "amparo_legal": "Lei 14.133/2021, Art. 28, I",
    "link_pncp": "https://cnetmobile.estaleiro.serpro.gov.br/comprasnet-web/public/landing?destino=acompanhamento-compra&compra=92649505900152024",
    "comarca_detectada": "da",
    "aditivos": [],
    "total_aditivos": 0
  },
  {
    "id": "PNCP_51174001000193-1-000040_2024",
    "numero": "2024/00038831",
    "tipo": "Serviços",
    "fornecedor": "A definir",
    "objeto": "Contratação de empresa especializada para prestação de Serviços de Vigilância e Segurança Patrimonial armada com a finalidade de exercer preventivamente a proteção do patrimônio e das pessoas que se encontram nos limites das localidades a serem vigiadas, com a efetiva cobertura de postos nas comarcas da 26ª e 31ª Circunscrições Judiciárias – 5ª Região Administrativa Judiciária (Comarca de Marília e outros), que constituem um Lote Único",
    "vigencia": "21/05/2024 a 21/05/2025",
    "valor": 15719855.7,
    "status": "ativo",
    "data_inicio": "2024-05-21T07:07:00",
    "data_fim": "2025-05-21T00:00:00",
    "fiscal_titular": "A definir",
    "fiscal_substituto": "A definir",
    "ultima_atualizacao": "2025-12-17T19:40:20.948283",
    "fonte": "PNCP",
    "controle_pncp": "51174001000193-1-000040/2024",
    "modalidade": "Pregão - Eletrônico",
    "amparo_legal": "Lei 14.133/2021, Art. 28, I",
    "link_pncp": "https://cnetmobile.estaleiro.serpro.gov.br/comprasnet-web/public/landing?destino=acompanhamento-compra&compra=92649505900122024",
    "comarca_detectada": "da",
    "aditivos": [],
    "total_aditivos": 0
  },
  {
    "id": "PNCP_51174001000193-1-000042_2024",
    "numero": "2024/00039075",
    "tipo": "Serviços",
    "fornecedor": "A definir",
    "objeto": "Contratação de empresa especializada para prestação de Serviços de Vigilância e Segurança Patrimonial armada com a finalidade de exercer preventivamente a proteção do patrimônio e das pessoas que se encontram nos limites das localidades a serem vigiadas, com a efetiva cobertura de postos nas comarcas da 27ª e 30ª Circunscrições Judiciárias – 5ª Região Administrativa Judiciária (Comarca de Presidente Prudente e outros), que constituem um Lote Único",
    "vigencia": "21/05/2024 a 21/05/2025",
    "valor": 18329776.2,
    "status": "ativo",
    "data_inicio": "2024-05-21T07:07:00",
    "data_fim": "2025-05-21T00:00:00",
    "fiscal_titular": "A definir",
    "fiscal_substituto": "A definir",
    "ultima_atualizacao": "2025-12-17T19:40:20.948383",
    "fonte": "PNCP",
    "controle_pncp": "51174001000193-1-000042/2024",
    "modalidade": "Pregão - Eletrônico",
    "amparo_legal": "Lei 14.133/2021, Art. 28, I",
    "link_pncp": "https://cnetmobile.estaleiro.serpro.gov.br/comprasnet-web/public/landing?destino=acompanhamento-compra&compra=92649505900132024",
    "comarca_detectada": "da",
    "aditivos": [],
    "total_aditivos": 0
  },
  {
    "id": "PNCP_51174001000193-1-000041_2024",
    "numero": "2024/00041564",
    "tipo": "Serviços",
    "fornecedor": "A definir",
    "objeto": "Contratação de Serviços de Vigilância e Segurança Patrimonial armada, com a efetiva cobertura de postos nas comarcas da 13ª e 42ª Circunscrições Judiciárias – 6ª Região Administrativa Judiciária (Comarcas de Araraquara, Jaboticabal e outras), que constituem um Lote Único",
    "vigencia": "21/05/2024 a 21/05/2025",
    "valor": 21625499.7,
    "status": "ativo",
    "data_inicio": "2024-05-21T07:07:00",
    "data_fim": "2025-05-21T00:00:00",
    "fiscal_titular": "A definir",
    "fiscal_substituto": "A definir",
    "ultima_atualizacao": "2025-12-17T19:40:20.948479",
    "fonte": "PNCP",
    "controle_pncp": "51174001000193-1-000041/2024",
    "modalidade": "Pregão - Eletrônico",
    "amparo_legal": "Lei 14.133/2021, Art. 28, I",
    "link_pncp": "https://cnetmobile.estaleiro.serpro.gov.br/comprasnet-web/public/landing?destino=acompanhamento-compra&compra=92649505900142024",
    "comarca_detectada": "da",
    "aditivos": [],
    "total_aditivos": 0
  },
  {
    "id": "PNCP_51174001000193-1-000047_2024",
    "numero": "2024/00032097",
    "tipo": "Serviços",
    "fornecedor": "A definir",
    "objeto": "Constituição de Sistema de Registro de Preços para eventual contratação de material, serviços e/ou apoio logístico em eventos, originários e/ou apoiados pelo Tribunal de Justiça do Estado de São Paulo - TJSP,  que  poderão ser executados, sob demanda, em qualquer município do Estado de São Paulo, pertencente a quaisquer Regiões Administrativas Judiciárias",
    "vigencia": "24/05/2024 a 24/05/2025",
    "valor": 3053017.54,
    "status": "ativo",
    "data_inicio": "2024-05-24T07:14:00",
    "data_fim": "2025-05-24T00:00:00",
    "fiscal_titular": "A definir",
    "fiscal_substituto": "A definir",
    "ultima_atualizacao": "2025-12-17T19:40:20.948577",
    "fonte": "PNCP",
    "controle_pncp": "51174001000193-1-000047/2024",
    "modalidade": "Pregão - Eletrônico",
    "amparo_legal": "Lei 14.133/2021, Art. 28, I",
    "link_pncp": "https://cnetmobile.estaleiro.serpro.gov.br/comprasnet-web/public/landing?destino=acompanhamento-compra&compra=92649505900162024",
    "comarca_detectada": "Não especificada",
    "aditivos": [],
    "total_aditivos": 0
  },
  {
    "id": "PNCP_51174001000193-1-000049_2024",
    "numero": "2024/00021850",
    "tipo": "Fornecimento",
    "fornecedor": "A definir",
    "objeto": "Contratação de empresa especializada para o fornecimento de água mineral natural, potável, sem gás, acondicionada em garrafão plástico retornável, em regime de comodato, com capacidade para 20 litros e com lacre de segurança, com entrega parcelada e sucessiva, a serem distribuídos nas unidades da 6ª Região Administrativa Judiciária - 6ª RAJ - (43ª CJ – Casa Branca, Caconde, Mococa, Santa Cruz das Palmeiras, São José do Rio Pardo, São Sebastião da Grama e Tambaú), em Lote.",
    "vigencia": "29/05/2024 a 29/05/2025",
    "valor": 146640.0,
    "status": "ativo",
    "data_inicio": "2024-05-29T07:15:00",
    "data_fim": "2025-05-29T00:00:00",
    "fiscal_titular": "A definir",
    "fiscal_substituto": "A definir",
    "ultima_atualizacao": "2025-12-17T19:40:20.948725",
    "fonte": "PNCP",
    "controle_pncp": "51174001000193-1-000049/2024",
    "modalidade": "Pregão - Eletrônico",
    "amparo_legal": "Lei 14.133/2021, Art. 28, I",
    "link_pncp": "https://cnetmobile.estaleiro.serpro.gov.br/comprasnet-web/public/landing?destino=acompanhamento-compra&compra=92649505900182024",
    "comarca_detectada": "Não especificada",
    "aditivos": [],
    "total_aditivos": 0
  },
  {
    "id": "PNCP_51174001000193-1-000048_2024",
    "numero": "2024/00021850",
    "tipo": "Fornecimento",
    "fornecedor": "A definir",
    "objeto": "Contratação de empresa especializada para a execução da reforma das instalações elétricas, que compreende a instalação de quadros elétricos, iluminação, tomadas e adequação do Sistema de Proteção contra Descargas Atmosféricas - SPDA no prédio do Fórum da Comarca de Carapicuíba.",
    "vigencia": "27/05/2024 a 27/05/2025",
    "valor": 749800.0,
    "status": "ativo",
    "data_inicio": "2024-05-27T07:11:00",
    "data_fim": "2025-05-27T00:00:00",
    "fiscal_titular": "A definir",
    "fiscal_substituto": "A definir",
    "ultima_atualizacao": "2025-12-17T19:40:20.948917",
    "fonte": "PNCP",
    "controle_pncp": "51174001000193-1-000048/2024",
    "modalidade": "Pregão - Eletrônico",
    "amparo_legal": "Lei 14.133/2021, Art. 28, I",
    "link_pncp": "https://cnetmobile.estaleiro.serpro.gov.br/comprasnet-web/public/landing?destino=acompanhamento-compra&compra=92649505900172024",
    "comarca_detectada": "Carapicuíba",
    "aditivos": [],
    "total_aditivos": 0
  },
  {
    "id": "PNCP_51174001000193-1-000050_2024",
    "numero": "2024/00022170",
    "tipo": "Serviços",
    "fornecedor": "A definir",
    "objeto": "Contratação de empresa especializada para a prestação de serviços de ascensorista, com dedicação exclusiva de mão de obra, para atender aos prédios do Fórum João Mendes Júnior, GADE 23 de Maio, GADE 9 de Julho e GADE MMDC, que constituem um LOTE ÚNICO.",
    "vigencia": "04/06/2024 a 04/06/2025",
    "valor": 885998.4,
    "status": "ativo",
    "data_inicio": "2024-06-04T07:16:00",
    "data_fim": "2025-06-04T00:00:00",
    "fiscal_titular": "A definir",
    "fiscal_substituto": "A definir",
    "ultima_atualizacao": "2025-12-17T19:40:20.949070",
    "fonte": "PNCP",
    "controle_pncp": "51174001000193-1-000050/2024",
    "modalidade": "Pregão - Eletrônico",
    "amparo_legal": "Lei 14.133/2021, Art. 28, I",
    "link_pncp": "https://cnetmobile.estaleiro.serpro.gov.br/comprasnet-web/public/landing?destino=acompanhamento-compra&compra=92649505900192024",
    "comarca_detectada": "Não especificada",
    "aditivos": [],
    "total_aditivos": 0
  },
  {
    "id": "PNCP_51174001000193-1-000052_2024",
    "numero": "2024/00024548",
    "tipo": "Fornecimento",
    "fornecedor": "A definir",
    "objeto": "Contratação de empresa especializada para a execução da reforma das instalações elétricas que compreende a instalação de quadros elétricos, iluminação, tomadas e adequação de SPDA - Sistema de Proteção contra Descargas Atmosféricas no prédio do Fórum da Comarca de Nuporanga.",
    "vigencia": "05/06/2024 a 05/06/2025",
    "valor": 535200.0,
    "status": "ativo",
    "data_inicio": "2024-06-05T07:14:00",
    "data_fim": "2025-06-05T00:00:00",
    "fiscal_titular": "A definir",
    "fiscal_substituto": "A definir",
    "ultima_atualizacao": "2025-12-17T19:40:20.949221",
    "fonte": "PNCP",
    "controle_pncp": "51174001000193-1-000052/2024",
    "modalidade": "Pregão - Eletrônico",
    "amparo_legal": "Lei 14.133/2021, Art. 28, I",
    "link_pncp": "https://cnetmobile.estaleiro.serpro.gov.br/comprasnet-web/public/landing?destino=acompanhamento-compra&compra=92649505900202024",
    "comarca_detectada": "Nuporanga",
    "aditivos": [],
    "total_aditivos": 0
  },
  {
    "id": "PNCP_51174001000193-1-000054_2024",
    "numero": "2024/00021987",
    "tipo": "Serviços",
    "fornecedor": "A definir",
    "objeto": "Contratação de empresa especializada para a prestação de serviços de controle de pragas (desinsetização e desratização), com aplicação de produtos de primeira qualidade, aprovados pela Inspeção Sanitária competente, para diversos prédios da 1ª RAJ (Arujá, Carapicuíba, Cotia e outros)do Tribunal de Justiça do Estado de São Paulo, em Lote Único.",
    "vigencia": "05/06/2024 a 05/06/2025",
    "valor": 78828.19,
    "status": "ativo",
    "data_inicio": "2024-06-05T07:14:00",
    "data_fim": "2025-06-05T00:00:00",
    "fiscal_titular": "A definir",
    "fiscal_substituto": "A definir",
    "ultima_atualizacao": "2025-12-17T19:40:20.949370",
    "fonte": "PNCP",
    "controle_pncp": "51174001000193-1-000054/2024",
    "modalidade": "Pregão - Eletrônico",
    "amparo_legal": "Lei 14.133/2021, Art. 28, I",
    "link_pncp": "https://cnetmobile.estaleiro.serpro.gov.br/comprasnet-web/public/landing?destino=acompanhamento-compra&compra=92649505900222024",
    "comarca_detectada": "Não especificada",
    "aditivos": [],
    "total_aditivos": 0
  },
  {
    "id": "PNCP_51174001000193-1-000056_2024",
    "numero": "2024/00007099",
    "tipo": "Serviços",
    "fornecedor": "A definir",
    "objeto": "Contratação de empresa especializada para a prestação de serviços de Prevenção e Combate a Incêndio por Bombeiro/Bombeira Civil em 09 (nove) prédios do Tribunal de Justiça do Estado de São Paulo, que constituem um LOTE ÚNICO.",
    "vigencia": "06/06/2024 a 06/06/2025",
    "valor": 22668396.0,
    "status": "ativo",
    "data_inicio": "2024-06-06T07:14:00",
    "data_fim": "2025-06-06T00:00:00",
    "fiscal_titular": "A definir",
    "fiscal_substituto": "A definir",
    "ultima_atualizacao": "2025-12-17T19:40:20.949521",
    "fonte": "PNCP",
    "controle_pncp": "51174001000193-1-000056/2024",
    "modalidade": "Pregão - Eletrônico",
    "amparo_legal": "Lei 14.133/2021, Art. 28, I",
    "link_pncp": "https://cnetmobile.estaleiro.serpro.gov.br/comprasnet-web/public/landing?destino=acompanhamento-compra&compra=92649505900302024",
    "comarca_detectada": "Não especificada",
    "aditivos": [],
    "total_aditivos": 0
  },
  {
    "id": "PNCP_51174001000193-1-000053_2024",
    "numero": "2024/00025519",
    "tipo": "Fornecimento",
    "fornecedor": "A definir",
    "objeto": "Contratação de empresa especializada para a execução da reforma das instalações elétricas, que compreende a instalação de quadros elétricos, iluminação, tomadas e adequação do Sistema de Proteção contra Descargas Atmosféricas - SPDA no prédio do Fórum da Comarca de Taquaritinga.",
    "vigencia": "05/06/2024 a 05/06/2025",
    "valor": 650000.0,
    "status": "ativo",
    "data_inicio": "2024-06-05T07:14:00",
    "data_fim": "2025-06-05T00:00:00",
    "fiscal_titular": "A definir",
    "fiscal_substituto": "A definir",
    "ultima_atualizacao": "2025-12-17T19:40:20.949668",
    "fonte": "PNCP",
    "controle_pncp": "51174001000193-1-000053/2024",
    "modalidade": "Pregão - Eletrônico",
    "amparo_legal": "Lei 14.133/2021, Art. 28, I",
    "link_pncp": "https://cnetmobile.estaleiro.serpro.gov.br/comprasnet-web/public/landing?destino=acompanhamento-compra&compra=92649505900232024",
    "comarca_detectada": "Taquaritinga",
    "aditivos": [],
    "total_aditivos": 0
  },
  {
    "id": "PNCP_51174001000193-1-000059_2024",
    "numero": "2024/00025954",
    "tipo": "Serviços",
    "fornecedor": "A definir",
    "objeto": "Contratação de empresa especializada para a prestação de serviços de manutenção preventiva mensal e corretiva em Grupos Geradores de Energia e respectivas instalações, incluindo fornecimento e substituição de partes e peças, instalados em diversos prédios da 1ª Região Administrativa Judiciária – RAJ 1, em LOTE ÚNICO",
    "vigencia": "10/06/2024 a 10/06/2025",
    "valor": 141998.16,
    "status": "ativo",
    "data_inicio": "2024-06-10T07:14:00",
    "data_fim": "2025-06-10T00:00:00",
    "fiscal_titular": "A definir",
    "fiscal_substituto": "A definir",
    "ultima_atualizacao": "2025-12-17T19:40:20.949846",
    "fonte": "PNCP",
    "controle_pncp": "51174001000193-1-000059/2024",
    "modalidade": "Pregão - Eletrônico",
    "amparo_legal": "Lei 14.133/2021, Art. 28, I",
    "link_pncp": "https://cnetmobile.estaleiro.serpro.gov.br/comprasnet-web/public/landing?destino=acompanhamento-compra&compra=92649505900312024",
    "comarca_detectada": "RAJ 1",
    "aditivos": [],
    "total_aditivos": 0
  },
  {
    "id": "PNCP_51174001000193-1-000057_2024",
    "numero": "2024/00032447",
    "tipo": "Serviços",
    "fornecedor": "A definir",
    "objeto": "Contratação de empresa especializada para a prestação de serviços de manutenção preventiva mensal e corretiva em equipamentos de climatização, incluindo fornecimento e substituição de partes e peças, instalados em diversos prédios da 8ª Região Administrativa Judiciária – RAJ 8 (Comarca de São José do Rio Preto e outras)",
    "vigencia": "06/06/2024 a 06/06/2025",
    "valor": 480200.0,
    "status": "ativo",
    "data_inicio": "2024-06-06T07:14:00",
    "data_fim": "2025-06-06T00:00:00",
    "fiscal_titular": "A definir",
    "fiscal_substituto": "A definir",
    "ultima_atualizacao": "2025-12-17T19:40:20.950018",
    "fonte": "PNCP",
    "controle_pncp": "51174001000193-1-000057/2024",
    "modalidade": "Pregão - Eletrônico",
    "amparo_legal": "Lei 14.133/2021, Art. 28, I",
    "link_pncp": "https://cnetmobile.estaleiro.serpro.gov.br/comprasnet-web/public/landing?destino=acompanhamento-compra&compra=92649505900292024",
    "comarca_detectada": "RAJ 8",
    "aditivos": [],
    "total_aditivos": 0
  },
  {
    "id": "PNCP_51174001000193-1-000070_2024",
    "numero": "2023/800025516",
    "tipo": "Serviços",
    "fornecedor": "A definir",
    "objeto": "Prestação de serviços de manutenção preventiva mensal e corretiva em elevadores e plataformas elevatórias, incluindo fornecimento e substituição de partes e peças, instalados em diversos prédios da 9ª Região Administrativa Judiciária – RAJ (Campos do Jordão, Caraguatatuba, Cruzeiro, Ilhabela, Lorena, Paraibuna, Pindamonhangaba, Salesópolis, São José dos Campos, São Sebastião, Taubaté e Ubatuba), em Lote Único.",
    "vigencia": "13/06/2024 a 13/06/2025",
    "valor": 540000.0,
    "status": "ativo",
    "data_inicio": "2024-06-13T07:12:00",
    "data_fim": "2025-06-13T00:00:00",
    "fiscal_titular": "A definir",
    "fiscal_substituto": "A definir",
    "ultima_atualizacao": "2025-12-17T19:40:20.950198",
    "fonte": "PNCP",
    "controle_pncp": "51174001000193-1-000070/2024",
    "modalidade": "Pregão - Eletrônico",
    "amparo_legal": "Lei 14.133/2021, Art. 28, I",
    "link_pncp": "https://cnetmobile.estaleiro.serpro.gov.br/comprasnet-web/public/landing?destino=acompanhamento-compra&compra=92649505900362024",
    "comarca_detectada": "Não especificada",
    "aditivos": [],
    "total_aditivos": 0
  },
  {
    "id": "PNCP_51174001000193-1-000060_2024",
    "numero": "2024/00025092",
    "tipo": "Serviços",
    "fornecedor": "A definir",
    "objeto": "Contratação de empresa especializada para a prestação de serviços de manutenção preventiva mensal e corretiva para elevadores e plataformas elevatórias, incluindo o fornecimento e substituição de partes e peças, instalados em diversos prédios da 5ª Região Administrativa Judiciária do Tribunal de Justiça do Estado de São Paulo (Comarca de Presidente Prudente e outros), em LOTE ÚNICO.",
    "vigencia": "11/06/2024 a 11/06/2025",
    "valor": 157000.0,
    "status": "ativo",
    "data_inicio": "2024-06-11T07:13:00",
    "data_fim": "2025-06-11T00:00:00",
    "fiscal_titular": "A definir",
    "fiscal_substituto": "A definir",
    "ultima_atualizacao": "2025-12-17T19:40:20.950375",
    "fonte": "PNCP",
    "controle_pncp": "51174001000193-1-000060/2024",
    "modalidade": "Pregão - Eletrônico",
    "amparo_legal": "Lei 14.133/2021, Art. 28, I",
    "link_pncp": "https://cnetmobile.estaleiro.serpro.gov.br/comprasnet-web/public/landing?destino=acompanhamento-compra&compra=92649505900322024",
    "comarca_detectada": "Presidente Prudente e outros",
    "aditivos": [],
    "total_aditivos": 0
  },
  {
    "id": "PNCP_51174001000193-1-000069_2024",
    "numero": "2024/00016106",
    "tipo": "Fornecimento",
    "fornecedor": "A definir",
    "objeto": "Contratação de empresa especializada para a execução da reforma das instalações hidrossanitárias, no prédio do Fórum da Comarca de Santa Bárbara D’Oeste/SP.",
    "vigencia": "13/06/2024 a 13/06/2025",
    "valor": 1495000.0,
    "status": "ativo",
    "data_inicio": "2024-06-13T07:12:00",
    "data_fim": "2025-06-13T00:00:00",
    "fiscal_titular": "A definir",
    "fiscal_substituto": "A definir",
    "ultima_atualizacao": "2025-12-17T19:40:20.950534",
    "fonte": "PNCP",
    "controle_pncp": "51174001000193-1-000069/2024",
    "modalidade": "Pregão - Eletrônico",
    "amparo_legal": "Lei 14.133/2021, Art. 28, I",
    "link_pncp": "https://cnetmobile.estaleiro.serpro.gov.br/comprasnet-web/public/landing?destino=acompanhamento-compra&compra=92649505900352024",
    "comarca_detectada": "Santa Bárbara D",
    "aditivos": [],
    "total_aditivos": 0
  },
  {
    "id": "PNCP_51174001000193-1-000079_2024",
    "numero": "2024/00035433",
    "tipo": "Fornecimento",
    "fornecedor": "A definir",
    "objeto": "Contratação de empresa especializada para o fornecimento de água mineral natural, potável, sem gás, acondicionada em garrafão plástico retornável, em regime de comodato, com capacidade para 20 litros e com lacre de segurança, com entrega parcelada e sucessiva, a serem distribuídos nas unidades da 1ª Região Administrativa Judiciária – RAJ (Comarcas de Arujá, Ferraz de Vasconcelos, Guararema, Itaquaquecetuba, Mogi das Cruzes, Poá, Santa Isabel e Suzano), em Lote Único.",
    "vigencia": "18/06/2024 a 18/06/2025",
    "valor": 403351.2,
    "status": "ativo",
    "data_inicio": "2024-06-18T07:12:00",
    "data_fim": "2025-06-18T00:00:00",
    "fiscal_titular": "A definir",
    "fiscal_substituto": "A definir",
    "ultima_atualizacao": "2025-12-17T19:40:20.950697",
    "fonte": "PNCP",
    "controle_pncp": "51174001000193-1-000079/2024",
    "modalidade": "Pregão - Eletrônico",
    "amparo_legal": "Lei 14.133/2021, Art. 28, I",
    "link_pncp": "https://cnetmobile.estaleiro.serpro.gov.br/comprasnet-web/public/landing?destino=acompanhamento-compra&compra=92649505900412024",
    "comarca_detectada": "Arujá",
    "aditivos": [],
    "total_aditivos": 0
  },
  {
    "id": "PNCP_51174001000193-1-000072_2024",
    "numero": "2024/00035336",
    "tipo": "Fornecimento",
    "fornecedor": "A definir",
    "objeto": "Contratação de empresa especializada para a execução da reforma das instalações elétricas que compreende a instalação de quadros elétricos, iluminação, tomadas e aterramento da iluminação externa no prédio do Fórum da Comarca de Jales.",
    "vigencia": "13/06/2024 a 13/06/2025",
    "valor": 887000.0,
    "status": "ativo",
    "data_inicio": "2024-06-13T07:12:00",
    "data_fim": "2025-06-13T00:00:00",
    "fiscal_titular": "A definir",
    "fiscal_substituto": "A definir",
    "ultima_atualizacao": "2025-12-17T19:40:20.950896",
    "fonte": "PNCP",
    "controle_pncp": "51174001000193-1-000072/2024",
    "modalidade": "Pregão - Eletrônico",
    "amparo_legal": "Lei 14.133/2021, Art. 28, I",
    "link_pncp": "https://cnetmobile.estaleiro.serpro.gov.br/comprasnet-web/public/landing?destino=acompanhamento-compra&compra=92649505900372024",
    "comarca_detectada": "Jales",
    "aditivos": [],
    "total_aditivos": 0
  },
  {
    "id": "PNCP_51174001000193-1-000078_2024",
    "numero": "2024/00031114",
    "tipo": "Fornecimento",
    "fornecedor": "A definir",
    "objeto": "Contratação de empresa especializada para a execução da reforma das instalações elétricas, que compreende a instalação de quadros elétricos, iluminação, tomadas e adequação de SPDA no prédio do Fórum da Comarca de Lins.",
    "vigencia": "18/06/2024 a 18/06/2025",
    "valor": 863900.0,
    "status": "ativo",
    "data_inicio": "2024-06-18T07:12:00",
    "data_fim": "2025-06-18T00:00:00",
    "fiscal_titular": "A definir",
    "fiscal_substituto": "A definir",
    "ultima_atualizacao": "2025-12-17T19:40:20.951083",
    "fonte": "PNCP",
    "controle_pncp": "51174001000193-1-000078/2024",
    "modalidade": "Pregão - Eletrônico",
    "amparo_legal": "Lei 14.133/2021, Art. 28, I",
    "link_pncp": "https://cnetmobile.estaleiro.serpro.gov.br/comprasnet-web/public/landing?destino=acompanhamento-compra&compra=92649505900402024",
    "comarca_detectada": "Lins",
    "aditivos": [],
    "total_aditivos": 0
  },
  {
    "id": "PNCP_51174001000193-1-000075_2024",
    "numero": "2024/00035991",
    "tipo": "Serviços",
    "fornecedor": "A definir",
    "objeto": "Contratação de empresa especializada para a prestação de serviços de manutenção preventiva mensal e corretiva em equipamentos de climatização, incluindo fornecimento e substituição de partes e peças, instalados em diversos prédios da 1ª Região Administrativa Judiciária – RAJ 1 (Comarca de São Paulo e outras), em LOTE ÚNICO",
    "vigencia": "17/06/2024 a 17/06/2025",
    "valor": 501008.52,
    "status": "ativo",
    "data_inicio": "2024-06-17T07:12:00",
    "data_fim": "2025-06-17T00:00:00",
    "fiscal_titular": "A definir",
    "fiscal_substituto": "A definir",
    "ultima_atualizacao": "2025-12-17T19:40:20.951256",
    "fonte": "PNCP",
    "controle_pncp": "51174001000193-1-000075/2024",
    "modalidade": "Pregão - Eletrônico",
    "amparo_legal": "Lei 14.133/2021, Art. 28, I",
    "link_pncp": "https://cnetmobile.estaleiro.serpro.gov.br/comprasnet-web/public/landing?destino=acompanhamento-compra&compra=92649505900392024",
    "comarca_detectada": "RAJ 1",
    "aditivos": [],
    "total_aditivos": 0
  },
  {
    "id": "PNCP_51174001000193-1-000083_2024",
    "numero": "2024/00025966",
    "tipo": "Fornecimento",
    "fornecedor": "A definir",
    "objeto": "Contratação de empresa especializada para a execução da reforma das instalações elétricas que compreende a instalação de quadros elétricos, iluminação, tomadas e adequação de SPDA - Sistema de Proteção contra Descargas Atmosféricas no prédio do Fórum da Comarca de Cafelândia.",
    "vigencia": "19/06/2024 a 19/06/2025",
    "valor": 421000.0,
    "status": "ativo",
    "data_inicio": "2024-06-19T07:12:00",
    "data_fim": "2025-06-19T00:00:00",
    "fiscal_titular": "A definir",
    "fiscal_substituto": "A definir",
    "ultima_atualizacao": "2025-12-17T19:40:20.951440",
    "fonte": "PNCP",
    "controle_pncp": "51174001000193-1-000083/2024",
    "modalidade": "Pregão - Eletrônico",
    "amparo_legal": "Lei 14.133/2021, Art. 28, I",
    "link_pncp": "https://cnetmobile.estaleiro.serpro.gov.br/comprasnet-web/public/landing?destino=acompanhamento-compra&compra=92649505900422024",
    "comarca_detectada": "Cafelândia",
    "aditivos": [],
    "total_aditivos": 0
  },
  {
    "id": "PNCP_51174001000193-1-000086_2024",
    "numero": "2024/00031040",
    "tipo": "Fornecimento",
    "fornecedor": "A definir",
    "objeto": "Contratação de empresa especializada para a execução da reforma das instalações elétricas que compreende a instalação de quadros elétricos, iluminação, tomadas e adequação do SPDA no prédio do Fórum da Comarca de Brotas.",
    "vigencia": "20/06/2024 a 20/06/2025",
    "valor": 630000.0,
    "status": "ativo",
    "data_inicio": "2024-06-20T07:14:00",
    "data_fim": "2025-06-20T00:00:00",
    "fiscal_titular": "A definir",
    "fiscal_substituto": "A definir",
    "ultima_atualizacao": "2025-12-17T19:40:20.951606",
    "fonte": "PNCP",
    "controle_pncp": "51174001000193-1-000086/2024",
    "modalidade": "Pregão - Eletrônico",
    "amparo_legal": "Lei 14.133/2021, Art. 28, I",
    "link_pncp": "https://cnetmobile.estaleiro.serpro.gov.br/comprasnet-web/public/landing?destino=acompanhamento-compra&compra=92649505900432024",
    "comarca_detectada": "Brotas",
    "aditivos": [],
    "total_aditivos": 0
  },
  {
    "id": "PNCP_51174001000193-1-000087_2024",
    "numero": "2024/00028437",
    "tipo": "Serviços",
    "fornecedor": "A definir",
    "objeto": "Contratação de empresa especializada para a execução dos serviços de instalação de Sistema de Proteção contra Descargas Atmosféricas - SPDA no prédio do Fórum da Comarca de Apiaí.",
    "vigencia": "20/06/2024 a 20/06/2025",
    "valor": 102800.0,
    "status": "ativo",
    "data_inicio": "2024-06-20T07:14:00",
    "data_fim": "2025-06-20T00:00:00",
    "fiscal_titular": "A definir",
    "fiscal_substituto": "A definir",
    "ultima_atualizacao": "2025-12-17T19:40:20.951775",
    "fonte": "PNCP",
    "controle_pncp": "51174001000193-1-000087/2024",
    "modalidade": "Pregão - Eletrônico",
    "amparo_legal": "Lei 14.133/2021, Art. 28, I",
    "link_pncp": "https://cnetmobile.estaleiro.serpro.gov.br/comprasnet-web/public/landing?destino=acompanhamento-compra&compra=92649505900442024",
    "comarca_detectada": "Apiaí",
    "aditivos": [],
    "total_aditivos": 0
  },
  {
    "id": "PNCP_51174001000193-1-000092_2024",
    "numero": "2024/00059841",
    "tipo": "Serviços",
    "fornecedor": "A definir",
    "objeto": "Contratação de empresa especializada para a prestação de Serviços de Controle, Operação e Fiscalização de Portarias e Edifícios, com a operação de catracas eletrônicas e estações de cadastramento e efetiva cobertura dos postos em comarcas da 2ª RAJ (Araçatuba), 3ª RAJ (Bauru), 5ª RAJ (Presidente Prudente), 6ª RAJ (Ribeirão Preto) e 8ª RAJ (São José do Rio Preto), que constituem um LOTE ÚNICO",
    "vigencia": "21/06/2024 a 21/06/2025",
    "valor": 9199628.1,
    "status": "ativo",
    "data_inicio": "2024-06-21T07:15:00",
    "data_fim": "2025-06-21T00:00:00",
    "fiscal_titular": "A definir",
    "fiscal_substituto": "A definir",
    "ultima_atualizacao": "2025-12-17T19:40:20.951891",
    "fonte": "PNCP",
    "controle_pncp": "51174001000193-1-000092/2024",
    "modalidade": "Pregão - Eletrônico",
    "amparo_legal": "Lei 14.133/2021, Art. 28, I",
    "link_pncp": "https://cnetmobile.estaleiro.serpro.gov.br/comprasnet-web/public/landing?destino=acompanhamento-compra&compra=92649505900462024",
    "comarca_detectada": "da",
    "aditivos": [],
    "total_aditivos": 0
  },
  {
    "id": "PNCP_51174001000193-1-000091_2024",
    "numero": "2024/00008886",
    "tipo": "Serviços",
    "fornecedor": "A definir",
    "objeto": "Prestação de serviços de manutenção preventiva mensal e corretiva para o Sistema de Circuito Fechado de Televisão - CFTV, bem como acessórios e respectivas instalações, incluindo o fornecimento e a substituição integral de partes e peças para o Fórum da Comarca de Botucatu, em lote Único.",
    "vigencia": "21/06/2024 a 21/06/2025",
    "valor": 48000.0,
    "status": "ativo",
    "data_inicio": "2024-06-21T07:15:00",
    "data_fim": "2025-06-21T00:00:00",
    "fiscal_titular": "A definir",
    "fiscal_substituto": "A definir",
    "ultima_atualizacao": "2025-12-17T19:40:20.951992",
    "fonte": "PNCP",
    "controle_pncp": "51174001000193-1-000091/2024",
    "modalidade": "Pregão - Eletrônico",
    "amparo_legal": "Lei 14.133/2021, Art. 28, I",
    "link_pncp": "https://cnetmobile.estaleiro.serpro.gov.br/comprasnet-web/public/landing?destino=acompanhamento-compra&compra=92649505900452024",
    "comarca_detectada": "Botucatu",
    "aditivos": [],
    "total_aditivos": 0
  },
  {
    "id": "PNCP_51174001000193-1-000090_2024",
    "numero": "2023/00136122",
    "tipo": "Fornecimento",
    "fornecedor": "A definir",
    "objeto": "Contratação de empresa especializada para o fornecimento de materiais de elétrica, hidráulica, pintura e alvenaria, para o prédio do Fórum João Mendes Júnior, localizado na Praça Dr. João Mendes, s/nº",
    "vigencia": "21/06/2024 a 21/06/2025",
    "valor": 66410.34,
    "status": "ativo",
    "data_inicio": "2024-06-21T07:14:00",
    "data_fim": "2025-06-21T00:00:00",
    "fiscal_titular": "A definir",
    "fiscal_substituto": "A definir",
    "ultima_atualizacao": "2025-12-17T19:40:20.952086",
    "fonte": "PNCP",
    "controle_pncp": "51174001000193-1-000090/2024",
    "modalidade": "Pregão - Eletrônico",
    "amparo_legal": "Lei 14.133/2021, Art. 28, I",
    "link_pncp": "https://cnetmobile.estaleiro.serpro.gov.br/comprasnet-web/public/landing?destino=acompanhamento-compra&compra=92649505900342024",
    "comarca_detectada": "Não especificada",
    "aditivos": [],
    "total_aditivos": 0
  },
  {
    "id": "PNCP_51174001000193-1-000096_2024",
    "numero": "2024/00025959",
    "tipo": "Serviços",
    "fornecedor": "A definir",
    "objeto": "Contratação de empresa especializada para a prestação de serviços de manutenção preventiva mensal e corretiva em elevadores e plataformas elevatórias, incluindo o fornecimento e substituição de partes e peças, instalados em diversos prédios da 10ª Região Administrativa Judiciária – RAJ 10 (Comarca de Sorocaba e outros), em LOTE ÚNICO.",
    "vigencia": "27/06/2024 a 27/06/2025",
    "valor": 199440.0,
    "status": "ativo",
    "data_inicio": "2024-06-27T07:13:00",
    "data_fim": "2025-06-27T00:00:00",
    "fiscal_titular": "A definir",
    "fiscal_substituto": "A definir",
    "ultima_atualizacao": "2025-12-17T19:40:20.952181",
    "fonte": "PNCP",
    "controle_pncp": "51174001000193-1-000096/2024",
    "modalidade": "Pregão - Eletrônico",
    "amparo_legal": "Lei 14.133/2021, Art. 28, I",
    "link_pncp": "https://cnetmobile.estaleiro.serpro.gov.br/comprasnet-web/public/landing?destino=acompanhamento-compra&compra=92649505900472024",
    "comarca_detectada": "RAJ 10",
    "aditivos": [],
    "total_aditivos": 0
  },
  {
    "id": "PNCP_51174001000193-1-000098_2024",
    "numero": "2024/00031118",
    "tipo": "Fornecimento",
    "fornecedor": "A definir",
    "objeto": "Contratação de empresa especializada para a execução da reforma das instalações elétricas que compreende a instalação de quadros elétricos, iluminação, tomadas e adequação de SPDA no prédio do Fórum da Comarca de Getulina.",
    "vigencia": "28/06/2024 a 28/06/2025",
    "valor": 349500.0,
    "status": "ativo",
    "data_inicio": "2024-06-28T07:13:00",
    "data_fim": "2025-06-28T00:00:00",
    "fiscal_titular": "A definir",
    "fiscal_substituto": "A definir",
    "ultima_atualizacao": "2025-12-17T19:40:20.952279",
    "fonte": "PNCP",
    "controle_pncp": "51174001000193-1-000098/2024",
    "modalidade": "Pregão - Eletrônico",
    "amparo_legal": "Lei 14.133/2021, Art. 28, I",
    "link_pncp": "https://cnetmobile.estaleiro.serpro.gov.br/comprasnet-web/public/landing?destino=acompanhamento-compra&compra=92649505900482024",
    "comarca_detectada": "Getulina",
    "aditivos": [],
    "total_aditivos": 0
  },
  {
    "id": "PNCP_51174001000193-1-000099_2024",
    "numero": "2024/00050923",
    "tipo": "Serviços",
    "fornecedor": "A definir",
    "objeto": "Contratação de empresa especializada para a prestação de serviços de manutenção preventiva mensal e corretiva em equipamentos de climatização, incluindo fornecimento e substituição de partes e peças, instalados em diversos prédios da 2ª Região Administrativa Judiciária – RAJ 2 (Comarca de Araçatuba e outras), em LOTE ÚNICO",
    "vigencia": "01/07/2024 a 01/07/2025",
    "valor": 482151.6,
    "status": "ativo",
    "data_inicio": "2024-07-01T07:11:00",
    "data_fim": "2025-07-01T00:00:00",
    "fiscal_titular": "A definir",
    "fiscal_substituto": "A definir",
    "ultima_atualizacao": "2025-12-17T19:40:20.952375",
    "fonte": "PNCP",
    "controle_pncp": "51174001000193-1-000099/2024",
    "modalidade": "Pregão - Eletrônico",
    "amparo_legal": "Lei 14.133/2021, Art. 28, I",
    "link_pncp": "https://cnetmobile.estaleiro.serpro.gov.br/comprasnet-web/public/landing?destino=acompanhamento-compra&compra=92649505900512024",
    "comarca_detectada": "RAJ 2",
    "aditivos": [],
    "total_aditivos": 0
  },
  {
    "id": "PNCP_51174001000193-1-000101_2024",
    "numero": "2024/00023762",
    "tipo": "Serviços",
    "fornecedor": "A definir",
    "objeto": "Contratação de empresa especializada para a prestação de serviços de gerenciamento de resíduos sólidos da classe II-A (não perigosos, não inertes) e classe I (perigosos), gerados e descartados pelos prédios do Tribunal de Justiça de São Paulo, situados na Capital, pertencentes à 1ª Região Administrativa Judiciária – 1ª RAJ, em LOTE ÚNICO",
    "vigencia": "01/07/2024 a 01/07/2025",
    "valor": 684473.1,
    "status": "ativo",
    "data_inicio": "2024-07-01T07:12:00",
    "data_fim": "2025-07-01T00:00:00",
    "fiscal_titular": "A definir",
    "fiscal_substituto": "A definir",
    "ultima_atualizacao": "2025-12-17T19:40:20.952470",
    "fonte": "PNCP",
    "controle_pncp": "51174001000193-1-000101/2024",
    "modalidade": "Pregão - Eletrônico",
    "amparo_legal": "Lei 14.133/2021, Art. 28, I",
    "link_pncp": "https://cnetmobile.estaleiro.serpro.gov.br/comprasnet-web/public/landing?destino=acompanhamento-compra&compra=92649505900502024",
    "comarca_detectada": "Não especificada",
    "aditivos": [],
    "total_aditivos": 0
  },
  {
    "id": "PNCP_51174001000193-1-000100_2024",
    "numero": "2023/00140724",
    "tipo": "Serviços",
    "fornecedor": "A definir",
    "objeto": "Serviços de garçom / garçonete e copeiro / copeira, com dedicação exclusiva de mão de obra, em diversos prédios do Tribunal de Justiça do Estado de São Paulo, localizados na Capital, que constituem um LOTE ÚNICO.",
    "vigencia": "01/07/2024 a 01/07/2025",
    "valor": 5609248.44,
    "status": "ativo",
    "data_inicio": "2024-07-01T07:12:00",
    "data_fim": "2025-07-01T00:00:00",
    "fiscal_titular": "A definir",
    "fiscal_substituto": "A definir",
    "ultima_atualizacao": "2025-12-17T19:40:20.952563",
    "fonte": "PNCP",
    "controle_pncp": "51174001000193-1-000100/2024",
    "modalidade": "Pregão - Eletrônico",
    "amparo_legal": "Lei 14.133/2021, Art. 28, I",
    "link_pncp": "https://cnetmobile.estaleiro.serpro.gov.br/comprasnet-web/public/landing?destino=acompanhamento-compra&compra=92649505900522024",
    "comarca_detectada": "Não especificada",
    "aditivos": [],
    "total_aditivos": 0
  },
  {
    "id": "PNCP_51174001000193-1-000104_2024",
    "numero": "2024/00031161",
    "tipo": "Fornecimento",
    "fornecedor": "A definir",
    "objeto": "Contratação de empresa especializada para a execução da reforma das instalações elétricas, que compreende a instalação de quadros elétricos, iluminação, tomadas e execução do novo Sistema de Proteção contra Descargas Atmosféricas - SPDA no prédio do Fórum da Comarca de Angatuba.",
    "vigencia": "02/07/2024 a 02/07/2025",
    "valor": 529500.0,
    "status": "ativo",
    "data_inicio": "2024-07-02T07:13:00",
    "data_fim": "2025-07-02T00:00:00",
    "fiscal_titular": "A definir",
    "fiscal_substituto": "A definir",
    "ultima_atualizacao": "2025-12-17T19:40:20.952659",
    "fonte": "PNCP",
    "controle_pncp": "51174001000193-1-000104/2024",
    "modalidade": "Pregão - Eletrônico",
    "amparo_legal": "Lei 14.133/2021, Art. 28, I",
    "link_pncp": "https://cnetmobile.estaleiro.serpro.gov.br/comprasnet-web/public/landing?destino=acompanhamento-compra&compra=92649505900552024",
    "comarca_detectada": "Angatuba",
    "aditivos": [],
    "total_aditivos": 0
  },
  {
    "id": "PNCP_51174001000193-1-000112_2024",
    "numero": "2024/00040667",
    "tipo": "Fornecimento",
    "fornecedor": "A definir",
    "objeto": "Fornecimento de água mineral natural, potável, sem gás, acondicionada em garrafão plástico retornável, em regime de comodato, com capacidade para 20 litros e com lacre de segurança, com entrega parcelada e sucessiva, a serem distribuídos nos prédios pertencentes à 1ª Região Administrativa Judiciária - 1ª RAJ - (Capital), em Lote Único.",
    "vigencia": "04/07/2024 a 04/07/2025",
    "valor": 2370584.7,
    "status": "ativo",
    "data_inicio": "2024-07-04T07:11:00",
    "data_fim": "2025-07-04T00:00:00",
    "fiscal_titular": "A definir",
    "fiscal_substituto": "A definir",
    "ultima_atualizacao": "2025-12-17T19:40:20.952787",
    "fonte": "PNCP",
    "controle_pncp": "51174001000193-1-000112/2024",
    "modalidade": "Pregão - Eletrônico",
    "amparo_legal": "Lei 14.133/2021, Art. 28, I",
    "link_pncp": "https://cnetmobile.estaleiro.serpro.gov.br/comprasnet-web/public/landing?destino=acompanhamento-compra&compra=92649505900602024",
    "comarca_detectada": "Não especificada",
    "aditivos": [],
    "total_aditivos": 0
  },
  {
    "id": "PNCP_51174001000193-1-000102_2024",
    "numero": "2024/00028434",
    "tipo": "Fornecimento",
    "fornecedor": "A definir",
    "objeto": "Execução da reforma das instalações elétricas, que compreende a instalação de quadros elétricos, iluminação, tomadas e aterramento da iluminação externa no prédio do Fórum da Comarca de Mococa",
    "vigencia": "02/07/2024 a 02/07/2025",
    "valor": 700800.0,
    "status": "ativo",
    "data_inicio": "2024-07-02T07:13:00",
    "data_fim": "2025-07-02T00:00:00",
    "fiscal_titular": "A definir",
    "fiscal_substituto": "A definir",
    "ultima_atualizacao": "2025-12-17T19:40:20.952894",
    "fonte": "PNCP",
    "controle_pncp": "51174001000193-1-000102/2024",
    "modalidade": "Pregão - Eletrônico",
    "amparo_legal": "Lei 14.133/2021, Art. 28, I",
    "link_pncp": "https://cnetmobile.estaleiro.serpro.gov.br/comprasnet-web/public/landing?destino=acompanhamento-compra&compra=92649505900532024",
    "comarca_detectada": "Mococa",
    "aditivos": [],
    "total_aditivos": 0
  },
  {
    "id": "PNCP_51174001000193-1-000105_2024",
    "numero": "2024/00035335",
    "tipo": "Fornecimento",
    "fornecedor": "A definir",
    "objeto": "Reforma das instalações elétricas, que compreende a instalação de quadros elétricos, iluminação, tomadas e execução do Sistema de Proteção contra Descargas Elétricas - SPDA no prédio do Fórum da Comarca de Penápolis",
    "vigencia": "03/07/2024 a 03/07/2025",
    "valor": 793000.0,
    "status": "ativo",
    "data_inicio": "2024-07-03T07:14:00",
    "data_fim": "2025-07-03T00:00:00",
    "fiscal_titular": "A definir",
    "fiscal_substituto": "A definir",
    "ultima_atualizacao": "2025-12-17T19:40:20.952992",
    "fonte": "PNCP",
    "controle_pncp": "51174001000193-1-000105/2024",
    "modalidade": "Pregão - Eletrônico",
    "amparo_legal": "Lei 14.133/2021, Art. 28, I",
    "link_pncp": "https://cnetmobile.estaleiro.serpro.gov.br/comprasnet-web/public/landing?destino=acompanhamento-compra&compra=92649505900562024",
    "comarca_detectada": "Penápolis",
    "aditivos": [],
    "total_aditivos": 0
  },
  {
    "id": "PNCP_51174001000193-1-000107_2024",
    "numero": "2024/00037412",
    "tipo": "Fornecimento",
    "fornecedor": "A definir",
    "objeto": "Reforma das instalações elétricas que compreende a instalação de quadros elétricos, iluminação e tomadas no prédio do Fórum da Comarca de São Caetano do Sul",
    "vigencia": "03/07/2024 a 03/07/2025",
    "valor": 1894000.0,
    "status": "ativo",
    "data_inicio": "2024-07-03T07:14:00",
    "data_fim": "2025-07-03T00:00:00",
    "fiscal_titular": "A definir",
    "fiscal_substituto": "A definir",
    "ultima_atualizacao": "2025-12-17T19:40:20.953088",
    "fonte": "PNCP",
    "controle_pncp": "51174001000193-1-000107/2024",
    "modalidade": "Pregão - Eletrônico",
    "amparo_legal": "Lei 14.133/2021, Art. 28, I",
    "link_pncp": "https://cnetmobile.estaleiro.serpro.gov.br/comprasnet-web/public/landing?destino=acompanhamento-compra&compra=92649505900582024",
    "comarca_detectada": "São Caetano do Sul",
    "aditivos": [],
    "total_aditivos": 0
  },
  {
    "id": "PNCP_51174001000193-1-000097_2024",
    "numero": "2024/00035940",
    "tipo": "Fornecimento",
    "fornecedor": "A definir",
    "objeto": "Agua mineral natural, potável, sem gás, acondicionada em garrafão plástico retornável, em regime de comodato, com capacidade para 20 litros e com lacre de segurança, com entrega parcelada e sucessiva.",
    "vigencia": "28/06/2024 a 28/06/2025",
    "valor": 157314.0,
    "status": "ativo",
    "data_inicio": "2024-06-28T07:12:00",
    "data_fim": "2025-06-28T00:00:00",
    "fiscal_titular": "A definir",
    "fiscal_substituto": "A definir",
    "ultima_atualizacao": "2025-12-17T19:40:20.953182",
    "fonte": "PNCP",
    "controle_pncp": "51174001000193-1-000097/2024",
    "modalidade": "Pregão - Eletrônico",
    "amparo_legal": "Lei 14.133/2021, Art. 28, I",
    "link_pncp": "https://cnetmobile.estaleiro.serpro.gov.br/comprasnet-web/public/landing?destino=acompanhamento-compra&compra=92649505900492024",
    "comarca_detectada": "Não especificada",
    "aditivos": [],
    "total_aditivos": 0
  },
  {
    "id": "PNCP_51174001000193-1-000103_2024",
    "numero": "2024/00028694",
    "tipo": "Fornecimento",
    "fornecedor": "A definir",
    "objeto": "Contratação de empresa especializada para fornecimento e instalação de Cortinas do tipo Rolô, em tela solar padrão, composta em sua maior parte por PVC, com tratamento antichamas e acionamento manual por corrente, nas cores creme, bege ou cinza claro, para o prédio do Fórum João Mendes Júnior - São Paulo/SP.",
    "vigencia": "02/07/2024 a 02/07/2025",
    "valor": 1041567.0,
    "status": "ativo",
    "data_inicio": "2024-07-02T07:13:00",
    "data_fim": "2025-07-02T00:00:00",
    "fiscal_titular": "A definir",
    "fiscal_substituto": "A definir",
    "ultima_atualizacao": "2025-12-17T19:40:20.953278",
    "fonte": "PNCP",
    "controle_pncp": "51174001000193-1-000103/2024",
    "modalidade": "Pregão - Eletrônico",
    "amparo_legal": "Lei 14.133/2021, Art. 28, I",
    "link_pncp": "https://cnetmobile.estaleiro.serpro.gov.br/comprasnet-web/public/landing?destino=acompanhamento-compra&compra=92649505900542024",
    "comarca_detectada": "Não especificada",
    "aditivos": [],
    "total_aditivos": 0
  },
  {
    "id": "PNCP_51174001000193-1-000114_2024",
    "numero": "2024/00048969",
    "tipo": "Fornecimento",
    "fornecedor": "A definir",
    "objeto": "Contratação de empresa especializada para a execução da reforma das instalações elétricas, que compreende a implantação de nova entrada de energia, adequação do Sistema de Proteção Contra Descargas Atmosféricas (SPDA), instalação de quadros elétricos, iluminação, tomadas de uso geral e pintura interna no prédio do Fórum da Comarca de Cruzeiro",
    "vigencia": "05/07/2024 a 05/07/2025",
    "valor": 859995.57,
    "status": "ativo",
    "data_inicio": "2024-07-05T07:15:00",
    "data_fim": "2025-07-05T00:00:00",
    "fiscal_titular": "A definir",
    "fiscal_substituto": "A definir",
    "ultima_atualizacao": "2025-12-17T19:40:20.953375",
    "fonte": "PNCP",
    "controle_pncp": "51174001000193-1-000114/2024",
    "modalidade": "Pregão - Eletrônico",
    "amparo_legal": "Lei 14.133/2021, Art. 28, I",
    "link_pncp": "https://cnetmobile.estaleiro.serpro.gov.br/comprasnet-web/public/landing?destino=acompanhamento-compra&compra=92649505900642024",
    "comarca_detectada": "Cruzeiro",
    "aditivos": [],
    "total_aditivos": 0
  },
  {
    "id": "PNCP_51174001000193-1-000106_2024",
    "numero": "2024/00035342",
    "tipo": "Fornecimento",
    "fornecedor": "A definir",
    "objeto": "Reforma das instalações elétricas que compreende a instalação de quadros elétricos, iluminação, tomadas e adequação do SPDA no prédio do Fórum da Comarca de Batatais",
    "vigencia": "03/07/2024 a 03/07/2025",
    "valor": 923000.0,
    "status": "ativo",
    "data_inicio": "2024-07-03T07:14:00",
    "data_fim": "2025-07-03T00:00:00",
    "fiscal_titular": "A definir",
    "fiscal_substituto": "A definir",
    "ultima_atualizacao": "2025-12-17T19:40:20.953471",
    "fonte": "PNCP",
    "controle_pncp": "51174001000193-1-000106/2024",
    "modalidade": "Pregão - Eletrônico",
    "amparo_legal": "Lei 14.133/2021, Art. 28, I",
    "link_pncp": "https://cnetmobile.estaleiro.serpro.gov.br/comprasnet-web/public/landing?destino=acompanhamento-compra&compra=92649505900572024",
    "comarca_detectada": "Batatais",
    "aditivos": [],
    "total_aditivos": 0
  },
  {
    "id": "PNCP_51174001000193-1-000113_2024",
    "numero": "2024/00048164",
    "tipo": "Fornecimento",
    "fornecedor": "A definir",
    "objeto": "Contratação de empresa especializada para a execução da reforma das instalações elétricas, que compreende a instalação de quadros elétricos, iluminação, tomadas comuns, pontos de alimentação de equipamentos de ar condicionado e adequação de Sistema de Proteção Contra Descargas Atmosféricas (SPDA) no prédio do Fórum da Comarca de Monte Alto.",
    "vigencia": "04/07/2024 a 04/07/2025",
    "valor": 350000.0,
    "status": "ativo",
    "data_inicio": "2024-07-04T07:11:00",
    "data_fim": "2025-07-04T00:00:00",
    "fiscal_titular": "A definir",
    "fiscal_substituto": "A definir",
    "ultima_atualizacao": "2025-12-17T19:40:20.953568",
    "fonte": "PNCP",
    "controle_pncp": "51174001000193-1-000113/2024",
    "modalidade": "Pregão - Eletrônico",
    "amparo_legal": "Lei 14.133/2021, Art. 28, I",
    "link_pncp": "https://cnetmobile.estaleiro.serpro.gov.br/comprasnet-web/public/landing?destino=acompanhamento-compra&compra=92649505900592024",
    "comarca_detectada": "Monte Alto",
    "aditivos": [],
    "total_aditivos": 0
  },
  {
    "id": "PNCP_51174001000193-1-000116_2024",
    "numero": "2024/00048158",
    "tipo": "Fornecimento",
    "fornecedor": "A definir",
    "objeto": "Contratação de empresa especializada para a execução da reforma das instalações elétricas que compreende a instalação de quadros elétricos, iluminação, tomadas e adequação do Sistema de Proteção contra Descargas Atmosféricas - SPDA no prédio do Fórum da Comarca de Guarulhos.",
    "vigencia": "05/07/2024 a 05/07/2025",
    "valor": 2819000.0,
    "status": "ativo",
    "data_inicio": "2024-07-05T07:15:00",
    "data_fim": "2025-07-05T00:00:00",
    "fiscal_titular": "A definir",
    "fiscal_substituto": "A definir",
    "ultima_atualizacao": "2025-12-17T19:40:20.953663",
    "fonte": "PNCP",
    "controle_pncp": "51174001000193-1-000116/2024",
    "modalidade": "Pregão - Eletrônico",
    "amparo_legal": "Lei 14.133/2021, Art. 28, I",
    "link_pncp": "https://cnetmobile.estaleiro.serpro.gov.br/comprasnet-web/public/landing?destino=acompanhamento-compra&compra=92649505900632024",
    "comarca_detectada": "Guarulhos",
    "aditivos": [],
    "total_aditivos": 0
  },
  {
    "id": "PNCP_51174001000193-1-000115_2024",
    "numero": "2024/00048114",
    "tipo": "Serviços",
    "fornecedor": "A definir",
    "objeto": "Execução de adequação da edificação às normas de segurança contra incêndio, com a adequação dos Sistemas de Prevenção e Proteção de Combate a Incêndio, demais serviços e materiais necessários ao seu perfeito funcionamento, bem como a obtenção do Auto de Vistoria do Corpo de Bombeiros – AVCB no edifício do Fórum da Comarca de Mogi Guaçu.",
    "vigencia": "05/07/2024 a 05/07/2025",
    "valor": 477000.0,
    "status": "ativo",
    "data_inicio": "2024-07-05T07:15:00",
    "data_fim": "2025-07-05T00:00:00",
    "fiscal_titular": "A definir",
    "fiscal_substituto": "A definir",
    "ultima_atualizacao": "2025-12-17T19:40:20.953780",
    "fonte": "PNCP",
    "controle_pncp": "51174001000193-1-000115/2024",
    "modalidade": "Pregão - Eletrônico",
    "amparo_legal": "Lei 14.133/2021, Art. 28, I",
    "link_pncp": "https://cnetmobile.estaleiro.serpro.gov.br/comprasnet-web/public/landing?destino=acompanhamento-compra&compra=92649505900622024",
    "comarca_detectada": "Mogi Guaçu",
    "aditivos": [],
    "total_aditivos": 0
  },
  {
    "id": "PNCP_51174001000193-1-000118_2024",
    "numero": "2024/048162",
    "tipo": "Fornecimento",
    "fornecedor": "A definir",
    "objeto": "Reforma das instalações elétricas que compreende a instalação de quadros elétricos, iluminação, tomadas e aterramento da iluminação externa no prédio do Fórum da Comarca de Santa Cruz das Palmeiras.",
    "vigencia": "11/07/2024 a 11/07/2025",
    "valor": 430500.0,
    "status": "ativo",
    "data_inicio": "2024-07-11T07:15:00",
    "data_fim": "2025-07-11T00:00:00",
    "fiscal_titular": "A definir",
    "fiscal_substituto": "A definir",
    "ultima_atualizacao": "2025-12-17T19:40:20.953878",
    "fonte": "PNCP",
    "controle_pncp": "51174001000193-1-000118/2024",
    "modalidade": "Pregão - Eletrônico",
    "amparo_legal": "Lei 14.133/2021, Art. 28, I",
    "link_pncp": "https://cnetmobile.estaleiro.serpro.gov.br/comprasnet-web/public/landing?destino=acompanhamento-compra&compra=92649505900662024",
    "comarca_detectada": "Santa Cruz das Palmeiras",
    "aditivos": [],
    "total_aditivos": 0
  },
  {
    "id": "PNCP_51174001000193-1-000119_2024",
    "numero": "2024/048178",
    "tipo": "Fornecimento",
    "fornecedor": "A definir",
    "objeto": "Reforma das instalações elétricas que compreende a instalação de nova entrada de energia, execução do Sistema de Proteção contra Descargas Atmosféricas (SPDA), instalação de quadros elétricos, iluminação, tomadas de uso geral, forros e pintura interna no prédio do Fórum da Comarca de Valparaíso.",
    "vigencia": "11/07/2024 a 11/07/2025",
    "valor": 197500.0,
    "status": "ativo",
    "data_inicio": "2024-07-11T07:15:00",
    "data_fim": "2025-07-11T00:00:00",
    "fiscal_titular": "A definir",
    "fiscal_substituto": "A definir",
    "ultima_atualizacao": "2025-12-17T19:40:20.953975",
    "fonte": "PNCP",
    "controle_pncp": "51174001000193-1-000119/2024",
    "modalidade": "Pregão - Eletrônico",
    "amparo_legal": "Lei 14.133/2021, Art. 28, I",
    "link_pncp": "https://cnetmobile.estaleiro.serpro.gov.br/comprasnet-web/public/landing?destino=acompanhamento-compra&compra=92649505900652024",
    "comarca_detectada": "Valparaíso",
    "aditivos": [],
    "total_aditivos": 0
  },
  {
    "id": "PNCP_51174001000193-1-000120_2024",
    "numero": "2024/00048155",
    "tipo": "Fornecimento",
    "fornecedor": "A definir",
    "objeto": "Reforma das instalações hidráulicas no prédio do Fórum da Comarca de Ibitinga.",
    "vigencia": "12/07/2024 a 12/07/2025",
    "valor": 411623.32,
    "status": "ativo",
    "data_inicio": "2024-07-12T07:15:00",
    "data_fim": "2025-07-12T00:00:00",
    "fiscal_titular": "A definir",
    "fiscal_substituto": "A definir",
    "ultima_atualizacao": "2025-12-17T19:40:20.954067",
    "fonte": "PNCP",
    "controle_pncp": "51174001000193-1-000120/2024",
    "modalidade": "Pregão - Eletrônico",
    "amparo_legal": "Lei 14.133/2021, Art. 28, I",
    "link_pncp": "https://cnetmobile.estaleiro.serpro.gov.br/comprasnet-web/public/landing?destino=acompanhamento-compra&compra=92649505900682024",
    "comarca_detectada": "Ibitinga",
    "aditivos": [],
    "total_aditivos": 0
  },
  {
    "id": "PNCP_51174001000193-1-000111_2024",
    "numero": "2024/00037414",
    "tipo": "Fornecimento",
    "fornecedor": "A definir",
    "objeto": "Execução da reforma das instalações elétricas que compreende a instalação de quadros elétricos, iluminação, tomadas e aterramento da iluminação externa no prédio do Fórum da Comarca de Limeira.",
    "vigencia": "04/07/2024 a 04/07/2025",
    "valor": 1337999.98,
    "status": "ativo",
    "data_inicio": "2024-07-04T07:10:00",
    "data_fim": "2025-07-04T00:00:00",
    "fiscal_titular": "A definir",
    "fiscal_substituto": "A definir",
    "ultima_atualizacao": "2025-12-17T19:40:20.954159",
    "fonte": "PNCP",
    "controle_pncp": "51174001000193-1-000111/2024",
    "modalidade": "Pregão - Eletrônico",
    "amparo_legal": "Lei 14.133/2021, Art. 28, I",
    "link_pncp": "https://cnetmobile.estaleiro.serpro.gov.br/comprasnet-web/public/landing?destino=acompanhamento-compra&compra=92649505900612024",
    "comarca_detectada": "Limeira",
    "aditivos": [],
    "total_aditivos": 0
  },
  {
    "id": "PNCP_51174001000193-1-000121_2024",
    "numero": "2024/00048962",
    "tipo": "Fornecimento",
    "fornecedor": "A definir",
    "objeto": "Reforma das instalações elétricas que compreende a instalação de quadros elétricos, iluminação, tomadas e adequação do SPDA no prédio do Fórum da Comarca de Piracicaba I (principal).",
    "vigencia": "12/07/2024 a 12/07/2025",
    "valor": 2093998.06,
    "status": "ativo",
    "data_inicio": "2024-07-12T07:16:00",
    "data_fim": "2025-07-12T00:00:00",
    "fiscal_titular": "A definir",
    "fiscal_substituto": "A definir",
    "ultima_atualizacao": "2025-12-17T19:40:20.954252",
    "fonte": "PNCP",
    "controle_pncp": "51174001000193-1-000121/2024",
    "modalidade": "Pregão - Eletrônico",
    "amparo_legal": "Lei 14.133/2021, Art. 28, I",
    "link_pncp": "https://cnetmobile.estaleiro.serpro.gov.br/comprasnet-web/public/landing?destino=acompanhamento-compra&compra=92649505900692024",
    "comarca_detectada": "Piracicaba I",
    "aditivos": [],
    "total_aditivos": 0
  },
  {
    "id": "PNCP_51174001000193-1-000122_2024",
    "numero": "2024/00050544",
    "tipo": "Fornecimento",
    "fornecedor": "A definir",
    "objeto": "Reforma das instalações elétricas que compreende a instalação de quadros elétricos, iluminação, tomadas e adequação de SPDA no prédio do Fórum da Comarca de Martinópolis.",
    "vigencia": "12/07/2024 a 12/07/2025",
    "valor": 244999.37,
    "status": "ativo",
    "data_inicio": "2024-07-12T07:16:00",
    "data_fim": "2025-07-12T00:00:00",
    "fiscal_titular": "A definir",
    "fiscal_substituto": "A definir",
    "ultima_atualizacao": "2025-12-17T19:40:20.954344",
    "fonte": "PNCP",
    "controle_pncp": "51174001000193-1-000122/2024",
    "modalidade": "Pregão - Eletrônico",
    "amparo_legal": "Lei 14.133/2021, Art. 28, I",
    "link_pncp": "https://cnetmobile.estaleiro.serpro.gov.br/comprasnet-web/public/landing?destino=acompanhamento-compra&compra=92649505900672024",
    "comarca_detectada": "Martinópolis",
    "aditivos": [],
    "total_aditivos": 0
  },
  {
    "id": "PNCP_51174001000193-1-000123_2024",
    "numero": "2024/00048960",
    "tipo": "Fornecimento",
    "fornecedor": "A definir",
    "objeto": "Reforma das instalações elétricas que compreende a instalação de quadros elétricos, iluminação, tomadas e adequação de SPDA no prédio do Fórum da Comarca de Araras.",
    "vigencia": "15/07/2024 a 15/07/2025",
    "valor": 898954.02,
    "status": "ativo",
    "data_inicio": "2024-07-15T07:14:00",
    "data_fim": "2025-07-15T00:00:00",
    "fiscal_titular": "A definir",
    "fiscal_substituto": "A definir",
    "ultima_atualizacao": "2025-12-17T19:40:20.954436",
    "fonte": "PNCP",
    "controle_pncp": "51174001000193-1-000123/2024",
    "modalidade": "Pregão - Eletrônico",
    "amparo_legal": "Lei 14.133/2021, Art. 28, I",
    "link_pncp": "https://cnetmobile.estaleiro.serpro.gov.br/comprasnet-web/public/landing?destino=acompanhamento-compra&compra=92649505900702024",
    "comarca_detectada": "Araras",
    "aditivos": [],
    "total_aditivos": 0
  },
  {
    "id": "PNCP_51174001000193-1-000127_2024",
    "numero": "2023/00125099",
    "tipo": "Fornecimento",
    "fornecedor": "A definir",
    "objeto": "Contratação de empresa especializada para a execução da reforma das instalações elétricas, que compreende a instalação de quadros elétricos, iluminação e tomadas no prédio do Fórum da Comarca de Tambaú.",
    "vigencia": "02/08/2024 a 02/08/2025",
    "valor": 593398.61,
    "status": "ativo",
    "data_inicio": "2024-08-02T07:16:00",
    "data_fim": "2025-08-02T00:00:00",
    "fiscal_titular": "A definir",
    "fiscal_substituto": "A definir",
    "ultima_atualizacao": "2025-12-17T19:40:20.954529",
    "fonte": "PNCP",
    "controle_pncp": "51174001000193-1-000127/2024",
    "modalidade": "Pregão - Eletrônico",
    "amparo_legal": "Lei 14.133/2021, Art. 28, I",
    "link_pncp": "https://cnetmobile.estaleiro.serpro.gov.br/comprasnet-web/public/landing?destino=acompanhamento-compra&compra=92649505900712024",
    "comarca_detectada": "Tambaú",
    "aditivos": [],
    "total_aditivos": 0
  },
  {
    "id": "PNCP_51174001000193-1-000128_2024",
    "numero": "2024/00037406",
    "tipo": "Fornecimento",
    "fornecedor": "A definir",
    "objeto": "Contratação de empresa especializada para a execução da sinalização de emergência para Proteção e Combate a Incêndio no prédio do Fórum João Mendes Junior.",
    "vigencia": "02/08/2024 a 02/08/2025",
    "valor": 0.0,
    "status": "ativo",
    "data_inicio": "2024-08-02T07:16:00",
    "data_fim": "2025-08-02T00:00:00",
    "fiscal_titular": "A definir",
    "fiscal_substituto": "A definir",
    "ultima_atualizacao": "2025-12-17T19:40:20.954619",
    "fonte": "PNCP",
    "controle_pncp": "51174001000193-1-000128/2024",
    "modalidade": "Pregão - Eletrônico",
    "amparo_legal": "Lei 14.133/2021, Art. 28, I",
    "link_pncp": "https://cnetmobile.estaleiro.serpro.gov.br/comprasnet-web/public/landing?destino=acompanhamento-compra&compra=92649505900722024",
    "comarca_detectada": "Não especificada",
    "aditivos": [],
    "total_aditivos": 0
  },
  {
    "id": "PNCP_51174001000193-1-000129_2024",
    "numero": "2024/00053186",
    "tipo": "Fornecimento",
    "fornecedor": "A definir",
    "objeto": "Contratação de empresa especializada para a execução da reforma das instalações elétricas que compreende a instalação de quadros elétricos, iluminação, tomadas e adequação do SPDA no prédio do Fórum da Comarca de Panorama.",
    "vigencia": "02/08/2024 a 02/08/2025",
    "valor": 545000.0,
    "status": "ativo",
    "data_inicio": "2024-08-02T07:17:00",
    "data_fim": "2025-08-02T00:00:00",
    "fiscal_titular": "A definir",
    "fiscal_substituto": "A definir",
    "ultima_atualizacao": "2025-12-17T19:40:20.954711",
    "fonte": "PNCP",
    "controle_pncp": "51174001000193-1-000129/2024",
    "modalidade": "Pregão - Eletrônico",
    "amparo_legal": "Lei 14.133/2021, Art. 28, I",
    "link_pncp": "https://cnetmobile.estaleiro.serpro.gov.br/comprasnet-web/public/landing?destino=acompanhamento-compra&compra=92649505900732024",
    "comarca_detectada": "Panorama",
    "aditivos": [],
    "total_aditivos": 0
  },
  {
    "id": "PNCP_51174001000193-1-000071_2024",
    "numero": "2024/00031067",
    "tipo": "Fornecimento",
    "fornecedor": "A definir",
    "objeto": "Execução da reforma das instalações elétricas que compreende a instalação de quadros elétricos, iluminação, tomadas e aterramento da iluminação externa no prédio do Fórum da Comarca de Mogi Mirim.",
    "vigencia": "13/06/2024 a 13/06/2025",
    "valor": 907800.0,
    "status": "ativo",
    "data_inicio": "2024-06-13T07:12:00",
    "data_fim": "2025-06-13T00:00:00",
    "fiscal_titular": "A definir",
    "fiscal_substituto": "A definir",
    "ultima_atualizacao": "2025-12-17T19:40:20.954829",
    "fonte": "PNCP",
    "controle_pncp": "51174001000193-1-000071/2024",
    "modalidade": "Pregão - Eletrônico",
    "amparo_legal": "Lei 14.133/2021, Art. 28, I",
    "link_pncp": "https://cnetmobile.estaleiro.serpro.gov.br/comprasnet-web/public/landing?destino=acompanhamento-compra&compra=92649505900382024",
    "comarca_detectada": "Mogi Mirim",
    "aditivos": [],
    "total_aditivos": 0
  },
  {
    "id": "PNCP_51174001000193-1-000132_2024",
    "numero": "2024/00063968",
    "tipo": "Fornecimento",
    "fornecedor": "A definir",
    "objeto": "Contratação de empresa especializada para reforma do fechamento perimetral (muros de divisa) do Fórum da Comarca de Rancharia.",
    "vigencia": "12/08/2024 a 12/08/2025",
    "valor": 169000.0,
    "status": "ativo",
    "data_inicio": "2024-08-12T07:16:00",
    "data_fim": "2025-08-12T00:00:00",
    "fiscal_titular": "A definir",
    "fiscal_substituto": "A definir",
    "ultima_atualizacao": "2025-12-17T19:40:20.954921",
    "fonte": "PNCP",
    "controle_pncp": "51174001000193-1-000132/2024",
    "modalidade": "Pregão - Eletrônico",
    "amparo_legal": "Lei 14.133/2021, Art. 28, I",
    "link_pncp": "https://cnetmobile.estaleiro.serpro.gov.br/comprasnet-web/public/landing?destino=acompanhamento-compra&compra=92649505900802024",
    "comarca_detectada": "Rancharia",
    "aditivos": [],
    "total_aditivos": 0
  },
  {
    "id": "PNCP_51174001000193-1-000133_2024",
    "numero": "2023/00123714",
    "tipo": "Serviços",
    "fornecedor": "A definir",
    "objeto": "Adequação da edificação às normas de segurança contra incêndio e execução de Sistemas de Prevenção e Combate a Incêndio no Fórum da Comarca de Bauru, serviços auxiliares e materiais necessários ao seu perfeito funcionamento, bem como a obtenção do Auto de Vistoria do Corpo de Bombeiros – AVCB.",
    "vigencia": "12/08/2024 a 12/08/2025",
    "valor": 108486.0,
    "status": "ativo",
    "data_inicio": "2024-08-12T07:16:00",
    "data_fim": "2025-08-12T00:00:00",
    "fiscal_titular": "A definir",
    "fiscal_substituto": "A definir",
    "ultima_atualizacao": "2025-12-17T19:40:20.955016",
    "fonte": "PNCP",
    "controle_pncp": "51174001000193-1-000133/2024",
    "modalidade": "Pregão - Eletrônico",
    "amparo_legal": "Lei 14.133/2021, Art. 28, I",
    "link_pncp": "https://cnetmobile.estaleiro.serpro.gov.br/comprasnet-web/public/landing?destino=acompanhamento-compra&compra=92649505900742024",
    "comarca_detectada": "Bauru",
    "aditivos": [],
    "total_aditivos": 0
  },
  {
    "id": "PNCP_51174001000193-1-000134_2024",
    "numero": "2024/00053151",
    "tipo": "Fornecimento",
    "fornecedor": "A definir",
    "objeto": "Contratação de empresa especializada para a execução de reforma da cobertura e impermeabilização de platibandas, no prédio do Fórum Regional III – Jabaquara.",
    "vigencia": "12/08/2024 a 12/08/2025",
    "valor": 830000.0,
    "status": "ativo",
    "data_inicio": "2024-08-12T07:16:00",
    "data_fim": "2025-08-12T00:00:00",
    "fiscal_titular": "A definir",
    "fiscal_substituto": "A definir",
    "ultima_atualizacao": "2025-12-17T19:40:20.955108",
    "fonte": "PNCP",
    "controle_pncp": "51174001000193-1-000134/2024",
    "modalidade": "Pregão - Eletrônico",
    "amparo_legal": "Lei 14.133/2021, Art. 28, I",
    "link_pncp": "https://cnetmobile.estaleiro.serpro.gov.br/comprasnet-web/public/landing?destino=acompanhamento-compra&compra=92649505900762024",
    "comarca_detectada": "Não especificada",
    "aditivos": [],
    "total_aditivos": 0
  },
  {
    "id": "PNCP_51174001000193-1-000136_2024",
    "numero": "2024/00055082",
    "tipo": "Fornecimento",
    "fornecedor": "A definir",
    "objeto": "Fornecimento de água mineral natural, potável, sem gás, acondicionada em garrafão plástico retornável, em regime de comodato, com capacidade para 20 litros e com lacre de segurança, com entrega parcelada e sucessiva, a serem distribuídos nas unidades da 16ª Circunscrição Judiciária, pertencentes à 8ª RAJ (Tanabi, José Bonifácio, Mirassol, Monte Aprazível, Nova Granada, Palestina, Paulo de Faria, Macaubal, Potirendaba, Neves Paulista e São José do Rio Preto), em Lote Único.",
    "vigencia": "13/08/2024 a 13/08/2025",
    "valor": 678192.0,
    "status": "ativo",
    "data_inicio": "2024-08-13T07:17:00",
    "data_fim": "2025-08-13T00:00:00",
    "fiscal_titular": "A definir",
    "fiscal_substituto": "A definir",
    "ultima_atualizacao": "2025-12-17T19:40:20.955205",
    "fonte": "PNCP",
    "controle_pncp": "51174001000193-1-000136/2024",
    "modalidade": "Pregão - Eletrônico",
    "amparo_legal": "Lei 14.133/2021, Art. 28, I",
    "link_pncp": "https://cnetmobile.estaleiro.serpro.gov.br/comprasnet-web/public/landing?destino=acompanhamento-compra&compra=92649505900772024",
    "comarca_detectada": "Não especificada",
    "aditivos": [],
    "total_aditivos": 0
  },
  {
    "id": "PNCP_51174001000193-1-000138_2024",
    "numero": "2024/00058872",
    "tipo": "Fornecimento",
    "fornecedor": "A definir",
    "objeto": "Execução de reforma da cobertura, impermeabilização de lajes e instalação de novo sistema de SPDA (Sistema de Proteção contra Descargas Atmosféricas), no prédio do Fórum da Comarca de São Simão.",
    "vigencia": "13/08/2024 a 13/08/2025",
    "valor": 360000.0,
    "status": "ativo",
    "data_inicio": "2024-08-13T07:18:00",
    "data_fim": "2025-08-13T00:00:00",
    "fiscal_titular": "A definir",
    "fiscal_substituto": "A definir",
    "ultima_atualizacao": "2025-12-17T19:40:20.955299",
    "fonte": "PNCP",
    "controle_pncp": "51174001000193-1-000138/2024",
    "modalidade": "Pregão - Eletrônico",
    "amparo_legal": "Lei 14.133/2021, Art. 28, I",
    "link_pncp": "https://cnetmobile.estaleiro.serpro.gov.br/comprasnet-web/public/landing?destino=acompanhamento-compra&compra=92649505900782024",
    "comarca_detectada": "São Simão",
    "aditivos": [],
    "total_aditivos": 0
  },
  {
    "id": "PNCP_51174001000193-1-000139_2024",
    "numero": "2023/00061252",
    "tipo": "Fornecimento",
    "fornecedor": "A definir",
    "objeto": "Contratação de empresa especializada para a execução da reforma das instalações elétricas, que compreende a execução da nova entrada de energia, instalação de quadros elétricos, iluminação, tomadas, sonorização da sala do júri e execução do novo Sistema de Proteção Contra Descargas Atmosféricas (SPDA), no prédio do Fórum da Comarca de Itapetininga",
    "vigencia": "13/08/2024 a 13/08/2025",
    "valor": 1504000.0,
    "status": "ativo",
    "data_inicio": "2024-08-13T07:18:00",
    "data_fim": "2025-08-13T00:00:00",
    "fiscal_titular": "A definir",
    "fiscal_substituto": "A definir",
    "ultima_atualizacao": "2025-12-17T19:40:20.955397",
    "fonte": "PNCP",
    "controle_pncp": "51174001000193-1-000139/2024",
    "modalidade": "Pregão - Eletrônico",
    "amparo_legal": "Lei 14.133/2021, Art. 28, I",
    "link_pncp": "https://cnetmobile.estaleiro.serpro.gov.br/comprasnet-web/public/landing?destino=acompanhamento-compra&compra=92649505900792024",
    "comarca_detectada": "Itapetininga",
    "aditivos": [],
    "total_aditivos": 0
  },
  {
    "id": "PNCP_51174001000193-1-000143_2024",
    "numero": "2024/00053190",
    "tipo": "Fornecimento",
    "fornecedor": "A definir",
    "objeto": "Reforma da cobertura no prédio do Fórum da Comarca de Casa Branca.",
    "vigencia": "14/08/2024 a 14/08/2025",
    "valor": 250000.0,
    "status": "ativo",
    "data_inicio": "2024-08-14T07:18:00",
    "data_fim": "2025-08-14T00:00:00",
    "fiscal_titular": "A definir",
    "fiscal_substituto": "A definir",
    "ultima_atualizacao": "2025-12-17T19:40:20.955488",
    "fonte": "PNCP",
    "controle_pncp": "51174001000193-1-000143/2024",
    "modalidade": "Pregão - Eletrônico",
    "amparo_legal": "Lei 14.133/2021, Art. 28, I",
    "link_pncp": "https://cnetmobile.estaleiro.serpro.gov.br/comprasnet-web/public/landing?destino=acompanhamento-compra&compra=92649505900812024",
    "comarca_detectada": "Casa Branca",
    "aditivos": [],
    "total_aditivos": 0
  },
  {
    "id": "PNCP_51174001000193-1-000144_2024",
    "numero": "2023/00050280",
    "tipo": "Fornecimento",
    "fornecedor": "A definir",
    "objeto": "Contratação de empresa especializada para a recuperação dos caixilhos no prédio do Fórum da Comarca de Avaré.",
    "vigencia": "14/08/2024 a 14/08/2025",
    "valor": 377602.03,
    "status": "ativo",
    "data_inicio": "2024-08-14T07:18:00",
    "data_fim": "2025-08-14T00:00:00",
    "fiscal_titular": "A definir",
    "fiscal_substituto": "A definir",
    "ultima_atualizacao": "2025-12-17T19:40:20.955581",
    "fonte": "PNCP",
    "controle_pncp": "51174001000193-1-000144/2024",
    "modalidade": "Pregão - Eletrônico",
    "amparo_legal": "Lei 14.133/2021, Art. 28, I",
    "link_pncp": "https://cnetmobile.estaleiro.serpro.gov.br/comprasnet-web/public/landing?destino=acompanhamento-compra&compra=92649505900832024",
    "comarca_detectada": "Avaré",
    "aditivos": [],
    "total_aditivos": 0
  },
  {
    "id": "PNCP_51174001000193-1-000145_2024",
    "numero": "2024/0061253",
    "tipo": "Fornecimento",
    "fornecedor": "A definir",
    "objeto": "Reforma das instalações elétricas, que compreende a instalação de quadros elétricos, iluminação, tomadas e adequação do SPDA no prédio do Fórum da Comarca de Piraju.",
    "vigencia": "14/08/2024 a 14/08/2025",
    "valor": 579800.0,
    "status": "ativo",
    "data_inicio": "2024-08-14T07:18:00",
    "data_fim": "2025-08-14T00:00:00",
    "fiscal_titular": "A definir",
    "fiscal_substituto": "A definir",
    "ultima_atualizacao": "2025-12-17T19:40:20.955672",
    "fonte": "PNCP",
    "controle_pncp": "51174001000193-1-000145/2024",
    "modalidade": "Pregão - Eletrônico",
    "amparo_legal": "Lei 14.133/2021, Art. 28, I",
    "link_pncp": "https://cnetmobile.estaleiro.serpro.gov.br/comprasnet-web/public/landing?destino=acompanhamento-compra&compra=92649505900822024",
    "comarca_detectada": "Piraju",
    "aditivos": [],
    "total_aditivos": 0
  },
  {
    "id": "PNCP_51174001000193-1-000147_2024",
    "numero": "2024/00061249",
    "tipo": "Fornecimento",
    "fornecedor": "A definir",
    "objeto": "Reforma da cobertura, impermeabilização de lajes, no prédio do Fórum da Comarca de Registro.",
    "vigencia": "15/08/2024 a 15/08/2025",
    "valor": 615415.94,
    "status": "ativo",
    "data_inicio": "2024-08-15T07:32:00",
    "data_fim": "2025-08-15T00:00:00",
    "fiscal_titular": "A definir",
    "fiscal_substituto": "A definir",
    "ultima_atualizacao": "2025-12-17T19:40:20.955795",
    "fonte": "PNCP",
    "controle_pncp": "51174001000193-1-000147/2024",
    "modalidade": "Pregão - Eletrônico",
    "amparo_legal": "Lei 14.133/2021, Art. 28, I",
    "link_pncp": "https://cnetmobile.estaleiro.serpro.gov.br/comprasnet-web/public/landing?destino=acompanhamento-compra&compra=92649505900842024",
    "comarca_detectada": "Registro",
    "aditivos": [],
    "total_aditivos": 0
  },
  {
    "id": "PNCP_51174001000193-1-000149_2024",
    "numero": "2024/00063956",
    "tipo": "Fornecimento",
    "fornecedor": "A definir",
    "objeto": "Reforma das instalações elétricas que compreende a instalação de quadros elétricos, iluminação externa e sistema de proteção contra descargas atmosféricas (SPDA) no prédio do Fórum da Comarca de Miracatu.",
    "vigencia": "15/08/2024 a 15/08/2025",
    "valor": 214444.0,
    "status": "ativo",
    "data_inicio": "2024-08-15T07:32:00",
    "data_fim": "2025-08-15T00:00:00",
    "fiscal_titular": "A definir",
    "fiscal_substituto": "A definir",
    "ultima_atualizacao": "2025-12-17T19:40:20.955897",
    "fonte": "PNCP",
    "controle_pncp": "51174001000193-1-000149/2024",
    "modalidade": "Pregão - Eletrônico",
    "amparo_legal": "Lei 14.133/2021, Art. 28, I",
    "link_pncp": "https://cnetmobile.estaleiro.serpro.gov.br/comprasnet-web/public/landing?destino=acompanhamento-compra&compra=92649505900852024",
    "comarca_detectada": "Miracatu",
    "aditivos": [],
    "total_aditivos": 0
  },
  {
    "id": "PNCP_51174001000193-1-000148_2024",
    "numero": "2023/00123428",
    "tipo": "Serviços",
    "fornecedor": "A definir",
    "objeto": "Contratação de empresa especializada para a execução do fechamento perimetral e seus serviços auxiliares para o Fórum da Comarca de Louveira.",
    "vigencia": "15/08/2024 a 15/08/2025",
    "valor": 316905.15,
    "status": "ativo",
    "data_inicio": "2024-08-15T07:32:00",
    "data_fim": "2025-08-15T00:00:00",
    "fiscal_titular": "A definir",
    "fiscal_substituto": "A definir",
    "ultima_atualizacao": "2025-12-17T19:40:20.955989",
    "fonte": "PNCP",
    "controle_pncp": "51174001000193-1-000148/2024",
    "modalidade": "Pregão - Eletrônico",
    "amparo_legal": "Lei 14.133/2021, Art. 28, I",
    "link_pncp": "https://cnetmobile.estaleiro.serpro.gov.br/comprasnet-web/public/landing?destino=acompanhamento-compra&compra=92649505900862024",
    "comarca_detectada": "Louveira",
    "aditivos": [],
    "total_aditivos": 0
  },
  {
    "id": "PNCP_51174001000193-1-000153_2024",
    "numero": "2024/00049196",
    "tipo": "Fornecimento",
    "fornecedor": "A definir",
    "objeto": "Fornecimento de baterias para desfibrilador externo automático.",
    "vigencia": "20/08/2024 a 20/08/2025",
    "valor": 16670.0,
    "status": "ativo",
    "data_inicio": "2024-08-20T07:17:00",
    "data_fim": "2025-08-20T00:00:00",
    "fiscal_titular": "A definir",
    "fiscal_substituto": "A definir",
    "ultima_atualizacao": "2025-12-17T19:40:20.956078",
    "fonte": "PNCP",
    "controle_pncp": "51174001000193-1-000153/2024",
    "modalidade": "Pregão - Eletrônico",
    "amparo_legal": "Lei 14.133/2021, Art. 28, I",
    "link_pncp": "https://cnetmobile.estaleiro.serpro.gov.br/comprasnet-web/public/landing?destino=acompanhamento-compra&compra=92649505900882024",
    "comarca_detectada": "Não especificada",
    "aditivos": [],
    "total_aditivos": 0
  },
  {
    "id": "PNCP_51174001000193-1-000150_2024",
    "numero": "2024/00058089",
    "tipo": "Fornecimento",
    "fornecedor": "A definir",
    "objeto": "Registro de Preços de pontos de rede lógica, óptica e elétrica, incluindo materiais e ativação de infraestrutura e equipamentos GPON",
    "vigencia": "15/08/2024 a 15/08/2025",
    "valor": 84558440.0,
    "status": "ativo",
    "data_inicio": "2024-08-15T07:33:00",
    "data_fim": "2025-08-15T00:00:00",
    "fiscal_titular": "A definir",
    "fiscal_substituto": "A definir",
    "ultima_atualizacao": "2025-12-17T19:40:20.956167",
    "fonte": "PNCP",
    "controle_pncp": "51174001000193-1-000150/2024",
    "modalidade": "Pregão - Eletrônico",
    "amparo_legal": "Lei 14.133/2021, Art. 28, I",
    "link_pncp": "https://cnetmobile.estaleiro.serpro.gov.br/comprasnet-web/public/landing?destino=acompanhamento-compra&compra=92649505900872024",
    "comarca_detectada": "Não especificada",
    "aditivos": [],
    "total_aditivos": 0
  },
  {
    "id": "PNCP_51174001000193-1-000155_2024",
    "numero": "2024/00057438",
    "tipo": "Fornecimento",
    "fornecedor": "A definir",
    "objeto": "Contratação de empresa especializada para o fornecimento de água mineral natural, potável, sem gás, acondicionada em garrafão plástico retornável, em regime de comodato, com capacidade para 20 litros e com lacre de segurança, com entrega parcelada e sucessiva, a serem distribuídos nas unidades da 1ª Região Administrativa Judiciária – Lote 3 (Comarcas de Cotia, Embu das Artes, Embu-Guaçu, Itapecerica da Serra, Itapevi, Taboão da Serra e Vargem Grande Paulista), em Lote único.",
    "vigencia": "26/08/2024 a 26/08/2025",
    "valor": 151008.0,
    "status": "ativo",
    "data_inicio": "2024-08-26T07:36:00",
    "data_fim": "2025-08-26T00:00:00",
    "fiscal_titular": "A definir",
    "fiscal_substituto": "A definir",
    "ultima_atualizacao": "2025-12-17T19:40:20.956265",
    "fonte": "PNCP",
    "controle_pncp": "51174001000193-1-000155/2024",
    "modalidade": "Pregão - Eletrônico",
    "amparo_legal": "Lei 14.133/2021, Art. 28, I",
    "link_pncp": "https://cnetmobile.estaleiro.serpro.gov.br/comprasnet-web/public/landing?destino=acompanhamento-compra&compra=92649505900892024",
    "comarca_detectada": "Cotia",
    "aditivos": [],
    "total_aditivos": 0
  },
  {
    "id": "PNCP_51174001000193-1-000157_2024",
    "numero": "2024/00052230",
    "tipo": "Fornecimento",
    "fornecedor": "A definir",
    "objeto": "Contratação de empresa especializada para o fornecimento de água mineral natural, potável, sem gás, acondicionada em garrafão plástico retornável, em regime de comodato, com capacidade para 20 litros e com lacre de segurança, com entrega parcelada e sucessiva, a serem distribuídos nas unidades da 6ª Região Administrativa Judiciária - 6ª RAJ - (40ª CJ – Ituverava, Guará, Igarapava, Ipuã, Miguelópolis e São Joaquim da Barra), em Lote Único.",
    "vigencia": "27/08/2024 a 27/08/2025",
    "valor": 127842.0,
    "status": "ativo",
    "data_inicio": "2024-08-27T07:19:00",
    "data_fim": "2025-08-27T00:00:00",
    "fiscal_titular": "A definir",
    "fiscal_substituto": "A definir",
    "ultima_atualizacao": "2025-12-17T19:40:20.956363",
    "fonte": "PNCP",
    "controle_pncp": "51174001000193-1-000157/2024",
    "modalidade": "Pregão - Eletrônico",
    "amparo_legal": "Lei 14.133/2021, Art. 28, I",
    "link_pncp": "https://cnetmobile.estaleiro.serpro.gov.br/comprasnet-web/public/landing?destino=acompanhamento-compra&compra=92649505900912024",
    "comarca_detectada": "Não especificada",
    "aditivos": [],
    "total_aditivos": 0
  },
  {
    "id": "PNCP_51174001000193-1-000156_2024",
    "numero": "2024/00050927",
    "tipo": "Serviços",
    "fornecedor": "A definir",
    "objeto": "Contratação de empresa especializada para a prestação de serviços de manutenção preventiva mensal e corretiva em equipamentos de climatização, incluindo fornecimento e substituição de partes e peças, instalados em diversos prédios da 6ª Região Administrativa Judiciária – RAJ 6 (Comarca de Ribeirão Preto e outros), em LOTE ÚNICO.",
    "vigencia": "27/08/2024 a 27/08/2025",
    "valor": 691824.0,
    "status": "ativo",
    "data_inicio": "2024-08-27T07:19:00",
    "data_fim": "2025-08-27T00:00:00",
    "fiscal_titular": "A definir",
    "fiscal_substituto": "A definir",
    "ultima_atualizacao": "2025-12-17T19:40:20.956453",
    "fonte": "PNCP",
    "controle_pncp": "51174001000193-1-000156/2024",
    "modalidade": "Pregão - Eletrônico",
    "amparo_legal": "Lei 14.133/2021, Art. 28, I",
    "link_pncp": "https://cnetmobile.estaleiro.serpro.gov.br/comprasnet-web/public/landing?destino=acompanhamento-compra&compra=92649505900902024",
    "comarca_detectada": "RAJ 6",
    "aditivos": [],
    "total_aditivos": 0
  },
  {
    "id": "PNCP_51174001000193-1-000159_2024",
    "numero": "2024/00061603",
    "tipo": "Serviços",
    "fornecedor": "A definir",
    "objeto": "Contratação de empresa especializada para a prestação de serviços de manutenção preventiva mensal e corretiva em equipamentos de climatização, incluindo fornecimento e substituição de partes e peças, instalados em diversos prédios da 1ª Região Administrativa Judiciária (Capital).",
    "vigencia": "29/08/2024 a 29/08/2025",
    "valor": 83848.28,
    "status": "ativo",
    "data_inicio": "2024-08-29T07:18:00",
    "data_fim": "2025-08-29T00:00:00",
    "fiscal_titular": "A definir",
    "fiscal_substituto": "A definir",
    "ultima_atualizacao": "2025-12-17T19:40:20.956546",
    "fonte": "PNCP",
    "controle_pncp": "51174001000193-1-000159/2024",
    "modalidade": "Pregão - Eletrônico",
    "amparo_legal": "Lei 14.133/2021, Art. 28, I",
    "link_pncp": "https://cnetmobile.estaleiro.serpro.gov.br/comprasnet-web/public/landing?destino=acompanhamento-compra&compra=92649505900922024",
    "comarca_detectada": "Não especificada",
    "aditivos": [],
    "total_aditivos": 0
  },
  {
    "id": "PNCP_51174001000193-1-000137_2024",
    "numero": "2023/00125094",
    "tipo": "Fornecimento",
    "fornecedor": "A definir",
    "objeto": "Contratação de empresa especializada para a execução da reforma das instalações elétricas, que compreende a instalação de quadros elétricos, iluminação, tomadas e adequação do SPDA no prédio do Fórum da Comarca de Taquarituba.",
    "vigencia": "13/08/2024 a 13/08/2025",
    "valor": 509900.0,
    "status": "ativo",
    "data_inicio": "2024-08-13T07:18:00",
    "data_fim": "2025-08-13T00:00:00",
    "fiscal_titular": "A definir",
    "fiscal_substituto": "A definir",
    "ultima_atualizacao": "2025-12-17T19:40:20.956638",
    "fonte": "PNCP",
    "controle_pncp": "51174001000193-1-000137/2024",
    "modalidade": "Pregão - Eletrônico",
    "amparo_legal": "Lei 14.133/2021, Art. 28, I",
    "link_pncp": "https://cnetmobile.estaleiro.serpro.gov.br/comprasnet-web/public/landing?destino=acompanhamento-compra&compra=92649505900752024",
    "comarca_detectada": "Taquarituba",
    "aditivos": [],
    "total_aditivos": 0
  },
  {
    "id": "PNCP_51174001000193-1-000167_2024",
    "numero": "2024/00061247",
    "tipo": "Fornecimento",
    "fornecedor": "A definir",
    "objeto": "Contratação de empresa especializada para a execução de adequação da edificação às normas de segurança contra incêndio e execução de Sistemas de Prevenção e Combate a Incêndio no edifício do Fórum da Comarca de Registro.",
    "vigencia": "10/09/2024 a 10/09/2025",
    "valor": 146807.8,
    "status": "ativo",
    "data_inicio": "2024-09-10T08:22:00",
    "data_fim": "2025-09-10T00:00:00",
    "fiscal_titular": "A definir",
    "fiscal_substituto": "A definir",
    "ultima_atualizacao": "2025-12-17T19:40:20.956748",
    "fonte": "PNCP",
    "controle_pncp": "51174001000193-1-000167/2024",
    "modalidade": "Pregão - Eletrônico",
    "amparo_legal": "Lei 14.133/2021, Art. 28, I",
    "link_pncp": "https://cnetmobile.estaleiro.serpro.gov.br/comprasnet-web/public/landing?destino=acompanhamento-compra&compra=92649505900952024",
    "comarca_detectada": "Registro",
    "aditivos": [],
    "total_aditivos": 0
  },
  {
    "id": "PNCP_51174001000193-1-000162_2024",
    "numero": "2023/00114168",
    "tipo": "Serviços",
    "fornecedor": "A definir",
    "objeto": "Contratação de empresa especializada para prestação de serviços de reparos, adequações pontuais e serviços comuns de engenharia nos prédios integrantes da 2ª, 3ª, 4ª, 7ª e 10ª RAJs, ocupados pelo Tribunal de Justiça do Estado de São Paulo, com fornecimento de material e mão de obra, em Lotes, por meio de Sistema de Registro de Preços, conforme edital.",
    "vigencia": "03/09/2024 a 03/09/2025",
    "valor": 14967874.17,
    "status": "ativo",
    "data_inicio": "2024-09-03T07:47:00",
    "data_fim": "2025-09-03T00:00:00",
    "fiscal_titular": "A definir",
    "fiscal_substituto": "A definir",
    "ultima_atualizacao": "2025-12-17T19:40:20.956851",
    "fonte": "PNCP",
    "controle_pncp": "51174001000193-1-000162/2024",
    "modalidade": "Pregão - Eletrônico",
    "amparo_legal": "Lei 14.133/2021, Art. 28, I",
    "link_pncp": "https://cnetmobile.estaleiro.serpro.gov.br/comprasnet-web/public/landing?destino=acompanhamento-compra&compra=92649505900932024",
    "comarca_detectada": "Não especificada",
    "aditivos": [],
    "total_aditivos": 0
  },
  {
    "id": "PNCP_51174001000193-1-000165_2024",
    "numero": "2024/00067555",
    "tipo": "Serviços",
    "fornecedor": "A definir",
    "objeto": "Contratação de empresa especializada para adequação dos prédios dos Fóruns da RAJ 2 (Araçatuba, Cafelândia e outros) às normas de segurança contra incêndio, com a adequação ou instalação de Sistemas de Prevenção e Combate a Incêndio, demais serviços e materiais necessários ao seu perfeito funcionamento, bem como a obtenção do Auto de Vistoria do Corpo de Bombeiros – AVCB para cada uma das referidas edificações.",
    "vigencia": "05/09/2024 a 05/09/2025",
    "valor": 2538000.0,
    "status": "ativo",
    "data_inicio": "2024-09-05T07:18:00",
    "data_fim": "2025-09-05T00:00:00",
    "fiscal_titular": "A definir",
    "fiscal_substituto": "A definir",
    "ultima_atualizacao": "2025-12-17T19:40:20.956942",
    "fonte": "PNCP",
    "controle_pncp": "51174001000193-1-000165/2024",
    "modalidade": "Pregão - Eletrônico",
    "amparo_legal": "Lei 14.133/2021, Art. 28, I",
    "link_pncp": "https://cnetmobile.estaleiro.serpro.gov.br/comprasnet-web/public/landing?destino=acompanhamento-compra&compra=92649505900942024",
